,STATION CODE,LOCATIONS,STATE,Temp,D.O. (mg/l),PH,CONDUCTIVITY (µmhos/cm),B.O.D. (mg/l),NITRATENAN N+ NITRITENANN (mg/l),FECAL COLIFORM (MPN/100ml),TOTAL COLIFORM (MPN/100ml)Mean,year,date
0,1393,DAMANGANGA AT D/S OF MADHUBAN,DAMAN & DIU,31.0,7.1,7.8,151.0,8.0,0.08,233.0,465.0,2012,2012-01-01
1,1150,DAMANGANGA AT KACHIGAON U\S AT GIDC WIER,GUJARAT,28.0,7.2,7.4,319.0,0.7,0.18,5.0,10.0,2012,2012-01-04
2,1865,RIVER DHADAR AT KOTHADA,GUJARAT,27.0,6.2,8.4,894.0,9.0,0.38,140.0,350.0,2012,2012-01-05
3,1149,KOLAK AT PATALIA BDG,GUJARAT,29.0,2.4,7.6,1500.0,6.2,1.31,3.0,13.0,2012,2012-01-06
4,1399,ZUARI AT D/S OF PT. WHERE KUMBARJRIA CANAL JOINS,GOA,31.0,5.9,7.2,52.0,2.1,0.08,233.0,90.0,2012,2012-01-07
5,1475,ZUARI AT PANCHAWADI,GOA,30.0,6.1,6.8,408.0,1.3,0.17,1300.0,3808.0,2012,2012-01-10
6,3181,RIVER ZUARI AT BORIM BRIDGE,GOA,30.0,5.5,6.9,143.0,1.3,0.09,4100.0,11113.0,2012,2012-01-13
7,3182,RIVER ZUARI AT MARCAIM JETTY,GOA,29.0,5.4,7.2,60.0,1.5,0.08,428.0,2309.0,2012,2012-01-15
8,1400,MANDOVI AT NEGHBOURHOOD OF PANAJI,GOA,29.0,5.8,7.2,34.0,5.3,0.17,855.0,3322.0,2012,2012-01-16
9,1476,"MANDOVI AT TONCA, MARCELA",GOA,29.0,5.9,6.7,125.0,1.5,0.14,1638.0,5793.0,2012,2012-01-17
10,3185,MANDOVI AT AMONA BRIDGE,GOA,28.0,6.4,6.7,175.0,1.3,0.1,772.0,3636.0,2012,2012-01-18
11,3186,RIVER MANDOVI AT IFFI JETTY,GOA,30.0,6.2,7.7,39.0,1.3,0.06,1296.0,4517.0,2012,2012-01-20
12,3187,MANDOVI NEAR HOTEL MARRIOT,GOA,30.0,6.1,7.8,39.0,1.5,0.06,1032.0,5840.0,2012,2012-01-22
13,1543,KALNA AT CHANDELNAN PERNEM,GOA,27.0,7.3,6.9,61.0,0.7,0.09,1430.0,4388.0,2012,2012-01-23
14,1548,RIVER ASSONORA AT ASSONORA,GOA,28.0,6.8,6.6,71.0,1.5,0.14,2495.0,3949.0,2012,2012-01-26
15,2276,"BICHOLIM VARAZAN NAGAR, BICHOLIM",GOA,29.0,7.4,6.5,129.0,2.3,0.49,5868.0,16691.0,2012,2012-01-27
16,2275,"RIVER CHAPORA NEAR ALORNA FORT ,PERNEM",GOA,28.0,7.0,6.8,503.0,1.6,0.66,965.0,2404.0,2012,2012-01-28
17,3189,RIVER CHAPORA AT SIOLIM,GOA,29.0,6.3,7.5,31.0,1.6,0.06,1466.0,4267.0,2012,2012-02-02
18,1546,KHANDEPAR AT OPA NAN PONDA,GOA,29.0,7.1,6.8,70.0,0.8,0.17,716.0,3567.0,2012,2012-02-04
19,2270,"KHANDEPAR AT CODLI NR BDG, U/S OPA WATERWORKS,SANGUEM",GOA,30.0,7.3,6.8,69.0,1.2,0.12,457.0,2446.0,2012,2012-02-05
20,2272,"RIVER KUSHAWATI NEAR BUND AT KEVONA,RIVON,SANGUEM",GOA,28.0,6.7,6.6,118.0,1.0,0.22,1104.0,3496.0,2012,2012-02-06
21,1545,RIVER MADAI AT DABOS NAN  VALPOI,GOA,28.0,7.4,6.8,80.0,1.3,0.06,274.0,1404.0,2012,2012-02-10
22,2274,RIVER MAPUSA ON CULVERT ON HIGHWAY MAPUSANANPANAJI,GOA,29.0,4.5,6.6,250.0,2.4,0.16,1572.0,5889.0,2012,2012-02-11
23,2271,"SAL PAZORKHONI, CUNCOLIM (NEAR CULVERT MARGAONAN CANACONA NATIONAL HIGHWAY)",GOA,28.0,6.1,6.9,74.0,1.8,0.19,1074.0,3937.0,2012,2012-02-12
24,2273,"RIVER SAL NEAR HOTEL LEELA MOBOR,CAVELOSSIM",GOA,30.0,5.9,7.3,44.0,1.6,0.14,962.0,2794.0,2012,2012-02-13
25,3183,"SAL AT KHAREBAND, MARGAO",GOA,30.0,2.4,6.5,195.0,4.8,0.35,7980.0,14217.0,2012,2012-02-15
26,3184,"SAL AT ORLIM BRIDGE, ORLIM",GOA,31.0,4.0,6.8,207.0,1.8,0.34,818.0,2280.0,2012,2012-02-16
27,3190,RIVER SINQUERIM (CANDOLIM SIDE NEAR BRIDGE),GOA,29.0,5.4,7.6,40.0,1.6,0.07,290.0,1330.0,2012,2012-02-18
28,3191,RIVER SINQUERIM NEAR NERUL TEMPLE,GOA,30.0,5.3,7.6,41.0,1.4,0.08,952.0,2517.0,2012,2012-02-19
29,1547,RIVER TALPONA AT CANACONA,GOA,29.0,7.0,6.9,54.0,0.8,0.21,667.0,3059.0,2012,2012-02-20
30,3188,RIVER TIRACOL AT TIRACOL,GOA,29.0,5.9,7.7,44.0,2.1,0.08,1200.0,831.0,2012,2012-02-21
31,1544,VALVANT AT SANKLI NAN BICHOLIM,GOA,29.0,7.1,6.5,60.0,1.7,0.13,2926.0,8163.0,2012,2012-02-22
32,2651,"AMBA AT D/S OF WAKEN BRIDGENANU/S OF JS PETROCHEMICALS, WAKENPHATA, ROHA",MAHARASHTRA,29.0,6.9,7.7,99.0,3.3,0.56,53.0,123.0,2012,2012-02-24
33,1461,BHATSA AT D/S OF PISE DAM NEAR PISE VILLAGE (ULHAS),MAHARASHTRA,30.0,6.6,7.9,123.0,3.2,0.52,44.0,104.0,2012,2012-02-25
34,2653,"BHATSA AT D/S OF LIBERTY OIL MILLS, SATNEL, SHAHAPUR,THANE",MAHARASHTRA,27.0,6.6,7.7,220.0,3.6,0.65,25.0,77.0,2012,2012-02-27
35,2654,"BHATSA AT U/S OF LIBERTY OIL MILLS, SATNEL, SHAHAPUR, THANE",MAHARASHTRA,27.0,6.8,7.7,219.0,3.4,0.63,23.0,75.0,2012,2012-03-01
36,1092,KALU AT ATALE VILLAGE,MAHARASHTRA,27.0,4.8,7.2,5429.0,8.4,2.08,177.0,408.0,2012,2012-03-02
37,2670,"KAN RIVER, NEAR SAKRI WATER WORKS, SAKRI, DHULE.",MAHARASHTRA,23.0,6.4,8.0,493.0,4.2,3.91,17.0,68.0,2012,2012-03-03
38,1152,KUNDALIKA AT ROHA CITY,MAHARASHTRA,29.0,6.8,7.6,100.0,3.0,0.54,124.0,295.0,2012,2012-03-04
39,2198,KUNDALIKA RIVER AT ARE KHURD ( SALINE ZONE ),MAHARASHTRA,29.0,6.7,7.5,316.0,4.6,0.6,47.0,132.0,2012,2012-03-05
40,2672,"KUNDALIKA AT DHATAV AT JACKWELL (DRINKING WATER  PUMPING STATIONNANSWEET ZONE), ROHA",MAHARASHTRA,29.0,6.9,7.7,84.0,3.1,0.42,69.0,168.0,2012,2012-03-06
41,2676,"MUCHKUNDI RIVER AT  WAKED, NEAR M/S ASAHI INDIA GLASS LTD., LANJA, RATNAGIRI.",MAHARASHTRA,28.0,6.9,7.9,312.0,2.7,1.58,4.0,107.0,2012,2012-03-07
42,1151,PATALGANGA AT SHILPHATA,MAHARASHTRA,29.0,6.8,7.5,146.0,3.0,0.6,124.0,241.0,2012,2012-03-08
43,1462,PATALGANGA NEAR INTAKE OF MIDC W/W,MAHARASHTRA,29.0,6.7,7.3,127.0,2.9,0.59,100.0,209.0,2012,2012-03-09
44,2685,"PATALGANGA RIVER AT D/S OF KHARPADA BRIDGE, RAIGAD.",MAHARASHTRA,29.0,5.6,6.9,432.0,4.5,1.72,58.0,173.0,2012,2012-03-10
45,2686,"PATALGANGA RIVER AT VYAL PUMP HOUSE , KHALAPUR, RAIGAD.",MAHARASHTRA,29.0,6.5,7.3,126.0,3.0,0.59,132.0,284.0,2012,2012-03-11
46,2687,"PATALGANGA RIVER AT KHALAPUR PUMPING STATION, KHALAPUR, RAIGAD.",MAHARASHTRA,30.0,7.1,7.5,128.0,3.0,0.6,136.0,297.0,2012,2012-03-12
47,2688,"PATALGANGA RIVER AT SAVROLI BRIDGE, KHALAPUR, RAIGAD.",MAHARASHTRA,30.0,6.4,7.3,129.0,3.1,0.6,68.0,191.0,2012,2012-03-14
48,2689,"PATALGANGA AT GAGANGIRI MAHARAJ TEMPLE, KHOPOLI, RAIGAD.",MAHARASHTRA,29.0,6.9,7.7,129.0,2.9,0.55,135.0,268.0,2012,2012-03-16
49,2696,"PEHLAR DAM ON PEHLAR INLET OF WATER WORKS, VASAI, THANE.",MAHARASHTRA,25.0,7.0,7.9,153.0,2.9,0.55,30.0,86.0,2012,2012-03-17
50,2199,SAVITRI RIVER AT OVALE VILLAGE.,MAHARASHTRA,30.0,6.4,7.6,10165.0,3.7,2.14,5.0,139.0,2012,2012-03-18
51,2701,"SAVITRI JACKWELL AT UPSA KENDRE, NANGALWADI, MAHAD, RAIGAD",MAHARASHTRA,30.0,6.9,7.7,307.0,2.8,3.6,4.0,123.0,2012,2012-03-19
52,2702,"SAVITRI RIVER AT SHEDAV DOH, MAHAD,RAIGAD",MAHARASHTRA,31.0,6.3,7.7,322.0,3.5,1.1,4.0,116.0,2012,2012-03-20
53,2703,"SAVITRI RIVER AT DADLI BRIDGE, DADLI, MAHAD, RAIGADH",MAHARASHTRA,30.0,6.5,7.5,5835.0,3.4,1.72,4.0,126.0,2012,2012-03-22
54,2704,"SAVITRI RIVER AT MUTHAVALI VILLAGE, MAHAD, RAIGADH",MAHARASHTRA,30.0,6.3,7.4,9245.0,4.7,2.0,4.0,134.0,2012,2012-03-23
55,2706,"SURYA RIVER, U/S OF SURYA DAM, DHAMMI, VIKRAMGAD, THANE",MAHARASHTRA,28.0,6.5,8.1,1907.0,4.0,0.55,46.0,115.0,2012,2012-03-24
56,2707,"SURYA AT MIDC PUMPING STN, GARVASHET, PALGHAR, THANE",MAHARASHTRA,28.0,7.0,8.0,1896.0,3.5,0.64,190.0,245.0,2012,2012-03-26
57,2708,"SURYA RIVER AT INTAKE OF VASAINANVIRAR W/S SCHEME, MASVAN, PALGHAR, THANE",MAHARASHTRA,28.0,7.0,8.0,206.0,2.9,0.56,31.0,74.0,2012,2012-03-27
58,2709,"TANSA RIVER NEAR ROAD BRIDGE, VILLAGE DAKEWALI, WADA, THANE",MAHARASHTRA,27.0,6.8,7.8,239.0,3.3,0.56,33.0,77.0,2012,2012-03-28
59,1093,ULHAS AT U/S OF NRC BUND AT MOHANE,MAHARASHTRA,27.0,6.4,7.6,152.0,3.2,0.96,62.0,142.0,2012,2012-04-01
60,1094,ULHAS AT U/S OF BADLAPUR,MAHARASHTRA,26.0,6.7,7.7,146.0,3.0,0.89,30.0,73.0,2012,2012-04-02
61,2162,ULHAS ATJAMBHUL WATER WORKS,MAHARASHTRA,27.0,6.7,7.6,137.0,2.9,0.76,24.0,64.0,2012,2012-04-04
62,2712,"VAITARNA NR RD BDG, GANDHARE VILLAGE, WADA, THANE.",MAHARASHTRA,28.0,6.6,7.8,228.0,3.5,0.57,30.0,79.0,2012,2012-04-05
63,2164,VASHISTI AT U/S OF THREE M PAPER MILLS NEAR M/S MULTIFILMS PLASTIC PVT. LTD. AT KHERDI.,MAHARASHTRA,23.0,7.0,7.7,409.0,2.4,0.93,4.0,112.0,2012,2012-04-06
64,2713,"VASHISHTI  AT D/S OF THREE M PAPER MILLS NR CHIPLUN WATER INTAKE JACKWELL,KHERDI,RATNAGIRI",MAHARASHTRA,22.0,6.8,7.6,263.0,2.9,0.81,4.0,123.0,2012,2012-04-07
65,2714,"VASHISHTI RIVER AT U/S OF POPHALI NEAR KONPHANSAWANE BRIDGE, CHIPLUN, RATNAGIRI",MAHARASHTRA,23.0,6.9,7.5,338.0,2.3,3.93,4.0,108.0,2012,2012-04-09
66,1342,ACHENKOIL AT THUMPAMON,KERALA,26.0,7.0,7.2,79.0,0.8,0.62,279.0,637.0,2012,2012-04-10
67,1443,ACHENKOIL AT CHENNITHULA,KERALA,26.0,6.6,7.0,67.0,1.1,0.53,275.0,670.0,2012,2012-04-11
68,3465,"ACHENKOIL AT KALLARAKADAVU, PATHANAMTHITTA",KERALA,26.0,6.6,7.3,59.0,0.7,0.57,281.0,541.0,2012,2012-04-12
69,3466,"ACHENKOIL AT PANDALAM (NEAR AYYAPPA TEMPLE),PATHANAMTHITTA",KERALA,26.0,6.2,7.3,66.0,0.8,0.55,303.0,609.0,2012,2012-04-13
70,2297,ANCHARAKANDY AT MERUVAMBA,KERALA,26.0,7.1,7.0,67.0,1.0,0.34,170.0,538.0,2012,2012-04-14
71,2319,ANCHARAKANDY AT MERUVAMBA,KERALA,26.0,7.0,6.7,5341.0,1.1,0.37,158.0,528.0,2012,2012-04-15
72,2286,R AYROOR AT AYROOR BRIDGE,KERALA,29.0,6.7,7.3,89.0,1.1,0.35,1163.0,2025.0,2012,2012-04-16
73,2331,BHARATHAPUZHA AT KUTTIPPURAM,KERALA,28.0,6.2,7.3,136.0,1.0,0.46,296.0,676.0,2012,2012-04-17
74,2332,R BHARATHAPUZHA AT PATTAMBI,KERALA,28.0,7.1,8.1,212.0,0.9,0.56,524.0,992.0,2012,2012-04-18
75,1154,CHALAKUDY AT PULICKALKANANDAVU,KERALA,29.0,6.3,6.3,134.0,1.2,0.67,224.0,780.0,2012,2012-04-19
76,20,CHALIYAR AT KOOLIMADU,KERALA,26.0,7.3,7.2,76.0,0.6,0.31,468.0,893.0,2012,2012-04-20
77,21,CHALIYAR AT CHUNGAPALLY,KERALA,26.0,7.0,7.3,11041.0,0.9,0.29,256.0,503.0,2012,2012-04-21
78,3464,"CHALIYAR AT NILAMBUR, MALAPPURAM",KERALA,28.0,6.8,7.1,75.0,0.8,0.5,693.0,1169.0,2012,2012-04-22
79,1572,CHANDRAGIRI AT PADIYATHADKA,KERALA,29.0,7.4,7.2,61.0,0.7,0.11,54.0,255.0,2012,2012-04-23
80,2295,R CORAPUZHA AT KANAYANKODE,KERALA,26.0,6.1,7.5,14083.0,1.4,0.25,920.0,2686.0,2012,2012-04-24
81,1564,"R ITHIKKARA AT AYUR, KERALA",KERALA,26.0,6.6,7.2,92.0,0.8,0.77,332.0,660.0,2012,2012-04-25
82,2287,R ITHIKKARA AT ITHIKKARA,KERALA,25.0,6.6,7.2,1348.0,0.8,1.01,392.0,810.0,2012,2012-04-26
83,1566,R KADALUNDI AT THIRURANGADY,KERALA,29.0,6.0,6.7,95.0,1.2,0.29,253.0,680.0,2012,2012-04-27
84,2293,R KADALUNDI AT HAJIRAPPALLY,KERALA,29.0,6.6,6.8,78.0,1.0,0.2,275.0,626.0,2012,2012-04-28
85,42,"KALLADA AT PERUMTHOTTAM KADAVU, PUNALOOR",KERALA,25.0,7.1,7.2,61.0,1.0,0.34,251.0,608.0,2012,2012-05-01
86,3460,"KALPATHI PUZHA AT KALPATHI, PALAKKAD",KERALA,27.0,6.6,8.0,310.0,1.1,0.54,517.0,783.0,2012,2012-05-02
87,3458,KARAPUZHA DAM AT WAYANAD,KERALA,27.0,7.0,7.1,97.0,0.8,0.35,45.0,77.0,2012,2012-05-03
88,1571,R KARINGODE AT KAKKADAVU,KERALA,29.0,7.3,7.0,51.0,0.7,0.18,65.0,258.0,2012,2012-05-04
89,3471,"RIVER KARAMANA AT ARUVIKARA, THIRUVANANTHAPURAM",KERALA,29.0,7.0,7.4,55.0,0.9,0.32,800.0,1400.0,2012,2012-05-05
90,2289,R KARUVANNURR AT KARUVANNUR BRIDGE,KERALA,29.0,6.1,6.8,67.0,1.1,0.58,80.0,394.0,2012,2012-05-06
91,2301,R KAVVAI AT KUTTIYOL PALAM,KERALA,27.0,7.0,6.7,61.0,1.3,0.28,168.0,248.0,2012,2012-05-07
92,2291,KEECHERI AT VADAKKANCHERY BDG,KERALA,30.0,5.2,6.9,81.0,1.5,0.37,71.0,465.0,2012,2012-05-08
93,2326,R KORAYAR AT KANJIKODE,KERALA,27.0,6.1,8.0,510.0,1.1,0.72,784.0,1572.0,2012,2012-05-10
94,1569,R KUPPAM AT THALIPARAMBA,KERALA,27.0,6.5,6.9,12150.0,1.8,0.52,711.0,1481.0,2012,2012-05-12
95,2298,R KUPPAM AT RAYAROM,KERALA,25.0,7.9,7.2,50.0,1.1,0.3,319.0,845.0,2012,2012-05-13
96,1567,R KUTTIYADE AT KUTTIYADY ESTATE,KERALA,25.0,7.5,6.9,34.0,0.9,0.14,110.0,256.0,2012,2012-05-14
97,1568,"R MAHE AT VALAYAM, KERALA",KERALA,26.0,7.0,7.4,72.0,1.0,0.38,496.0,897.0,2012,2012-05-15
98,2285,R MAMOM AT MAMOM BRIDGE,KERALA,29.0,7.3,7.3,99.0,0.9,0.23,1088.0,1788.0,2012,2012-05-16
99,1340,MANIMALA  AT KALLOOPARA,KERALA,27.0,7.5,6.9,125.0,1.6,0.45,970.0,1400.0,2012,2012-05-17
100,1384,MANIMALA AT THONDRA,KERALA,27.0,6.8,6.9,116.0,1.7,0.4,825.0,1260.0,2012,2012-05-18
101,3459,"MANIYANKODE PUZHA AT MANIYANKODE BRIDGE, WAYANAD",KERALA,27.0,5.8,7.3,107.0,0.9,0.88,232.0,343.0,2012,2012-05-19
102,2307,R MANJESWAR AT BAJRAKKARA BR.,KERALA,28.0,7.1,7.2,85.0,0.8,0.31,67.0,184.0,2012,2012-05-22
103,1339,MEENACHIL AT KIDANGOOR,KERALA,26.0,6.8,7.1,58.0,0.7,0.46,2010.0,3460.0,2012,2012-05-23
104,2304,R MOGRAL AT MOGRAL BR.,KERALA,29.0,5.7,7.3,13197.0,1.5,0.35,46.0,144.0,2012,2012-05-24
105,43,MUVATTAPUZHA AT VETTIKKATTUMUKKU,KERALA,27.0,6.7,7.1,58.0,1.2,0.39,964.0,1739.0,2012,2012-05-25
106,2302,NEELASWARAM AT NAMBIARKAL ,KERALA,28.0,7.0,6.9,3453.0,0.9,0.17,56.0,278.0,2012,2012-05-27
107,1570,R NEELESWARAM AT HOSDURG,KERALA,29.0,6.5,7.0,14369.0,1.3,0.27,63.0,175.0,2012,2012-05-28
108,1563,R NEYYAR AT AMARAVILA,KERALA,28.0,6.6,7.3,70.0,1.4,0.39,838.0,1875.0,2012,2012-06-01
109,2284,R NEYYAR AT ARUVIPURAM,KERALA,29.0,7.0,7.3,60.0,0.8,0.18,631.0,1813.0,2012,2012-06-02
110,2288,R PALLICKAL AT NELLIMUKAL,KERALA,26.0,6.3,7.2,97.0,0.8,0.56,357.0,880.0,2012,2012-06-03
111,1156,PAMBA AT CHENGANNUR,KERALA,28.0,6.0,7.0,63.0,1.1,1.04,243.0,493.0,2012,2012-06-04
112,1341,PAMBA AT THAKAZHY,KERALA,28.0,4.4,7.1,113.0,1.5,1.17,358.0,722.0,2012,2012-06-05
113,1565,PAMBA DOWN,KERALA,28.0,4.5,7.2,79.0,1.0,1.04,279.0,537.0,2012,2012-06-06
114,17,PERIYAR NEAR ALWAYENANELOOR,KERALA,28.0,5.1,6.9,1789.0,2.1,0.68,408.0,1946.0,2012,2012-06-07
115,18,PERIYAR AT KALADY,KERALA,27.0,7.5,7.2,36.0,1.1,0.27,282.0,1134.0,2012,2012-06-08
116,1338,PERIYAR AT SEWAGE DISCHARGE POINT,KERALA,28.0,6.8,7.0,59.0,1.3,0.32,648.0,2267.0,2012,2012-06-09
117,2333,PERIYAR AT MUPPATHADAM,KERALA,28.0,6.8,6.9,114.0,1.4,0.23,388.0,1785.0,2012,2012-06-10
118,2334,RIVER PERIYAR AT PATHALAM,KERALA,28.0,5.9,6.8,1108.0,2.2,0.62,386.0,1520.0,2012,2012-06-11
119,2335,R PERIYAR AT KALAMASSERY,KERALA,28.0,4.9,6.7,88.0,2.2,0.28,480.0,2200.0,2012,2012-06-12
120,2336,R PERIYAR AT PURAPPALLIKAVU,KERALA,28.0,6.8,6.9,1686.0,1.4,0.25,236.0,1223.0,2012,2012-06-14
121,3468,"PERIYAR AT KWA INTAKENAN ALUVA, ERNAKULAM",KERALA,28.0,7.1,6.9,45.0,1.2,0.29,451.0,1636.0,2012,2012-06-15
122,2300,PERUVAMBA AT CHANDAPPURA,KERALA,26.0,6.9,6.6,56.0,1.1,0.3,177.0,542.0,2012,2012-06-16
123,2303,R PULLUR AT PULLUR BR.,KERALA,28.0,6.5,6.3,49.0,1.0,0.22,87.0,323.0,2012,2012-06-17
124,2290,R PUZHACKAL AT PUZHACKAL BRIDGE,KERALA,29.0,4.9,6.6,169.0,2.1,0.76,250.0,1241.0,2012,2012-06-18
125,2305,R SHRIYA AT ANGADIMOGARU,KERALA,28.0,6.9,7.1,63.0,0.9,0.16,152.0,336.0,2012,2012-06-19
126,2296,THALLASSERY AT PATHIPPALAM,KERALA,26.0,6.6,6.7,69.0,0.8,0.38,185.0,464.0,2012,2012-06-20
127,2292,THIRUR AT THALAKKADATHUR BDG,KERALA,29.0,4.5,6.6,6381.0,2.1,0.34,196.0,435.0,2012,2012-06-21
128,2306,R UPPALA AT  UPPALA BR.,KERALA,29.0,6.2,7.2,9326.0,1.3,0.22,61.0,141.0,2012,2012-06-22
129,3473,"RIVER VALAPATTANAM AT PARASSINIKADAVU, KANNUR",KERALA,27.0,6.6,7.1,15158.0,1.1,0.26,126.0,810.0,2012,2012-06-24
130,1442,VAMANAPURAM,KERALA,29.0,6.3,7.3,74.0,1.2,0.29,725.0,1813.0,2012,2012-06-25
131,1448,NAGAVALLI AT THOTAPALLI REGULATOR,ANDHRA PRADESH,27.0,6.0,7.6,429.0,1.1,1.1,3.0,362.0,2012,2012-06-27
132,2352,"RIVER VAMSHADHARA, KALINGAPATNAM,VIZIANAGARAM",ANDHRA PRADESH,27.0,6.0,7.8,308.0,1.1,1.47,3.0,343.0,2012,2012-06-28
133,3080,"U/S OF KARAKAVAGU AT PALONCHA,  KHAMMAM",ANDHRA PRADESH,20.0,5.8,7.4,505.0,0.6,0.73,4.0,1517.0,2012,2012-07-01
134,3081,"D/S OF KARAKAVAGU AT PALONCHA,  KHAMMAM",ANDHRA PRADESH,24.0,6.1,7.5,465.0,0.5,0.34,4.0,1458.0,2012,2012-07-03
135,1444,KALI AT D/S WEST COAST PAPER MILL,KARNATAKA,28.0,6.4,7.1,183.0,2.3,0.62,209.0,398.0,2012,2012-07-04
136,2780,"KALI AT U/S OF WCPM, DANDELI",KARNATAKA,27.0,7.1,7.4,135.0,1.9,0.72,419.0,995.0,2012,2012-07-05
137,1894,KUMARADHARA NAN U/S OF UPPINAGADY TOWN B/C WITH RIVER NETHRAVATHI,KARNATAKA,32.0,6.7,7.2,103.0,1.0,0.52,11.0,70.0,2012,2012-07-07
138,1892,NETRAVATHI U/S OF DHARMASTALA AT WATER SUPPLY INTAKE POINT,KARNATAKA,30.0,6.8,7.1,106.0,1.0,0.52,13.0,137.0,2012,2012-07-08
139,2423,"BUDHABALANGA, D/S OF BARIPADA",ORISSA,22.0,7.8,7.9,213.0,1.5,0.35,7742.0,15083.0,2012,2012-07-09
140,2424,BUDHABALANGA AT BALASORE D/S,ORISSA,22.0,7.7,8.1,312.0,2.0,0.75,12675.0,32017.0,2012,2012-07-10
141,2425,"RIVER KERANDI(INTAKE WELL OF NALCO REFINARY, HAL, SUNABEDA)",ORISSA,24.0,6.9,7.6,99.0,1.6,1.39,3066.0,5395.0,2012,2012-07-11
142,2422,"NAGAVALLI AT PENTA U/S, JAYKAYPUR TOWN",ORISSA,27.0,7.3,8.0,230.0,1.6,0.69,2346.0,4348.0,2012,2012-07-12
143,1642,NAGAVALLI AT JAYKAYPUR D/S,ORISSA,26.0,6.8,8.1,264.0,2.6,1.16,2428.0,5142.0,2012,2012-07-14
144,1643,NAGAVALLI AT RAYAGADA D/S,ORISSA,25.0,7.2,8.1,272.0,3.1,1.46,2196.0,4586.0,2012,2012-07-15
145,1455,RUSHIKULYA AT GANJAM U/S,ORISSA,28.0,8.0,8.3,312.0,1.4,0.73,1618.0,4319.0,2012,2012-07-16
146,2426,VANSADHARA AT MUNIGUDA (D/S OF M/S VEDANTAALUMINA PROJECT),ORISSA,26.0,7.0,8.0,199.0,1.8,1.11,1503.0,3573.0,2012,2012-07-17
147,2427,VANSADHARA ATGUNUPUR (INTERSTATE BOUNDRY),ORISSA,28.0,7.2,8.1,201.0,1.6,0.36,1239.0,2324.0,2012,2012-07-18
148,1685,ARASALAR RIVER KARAIKAL REGION,PONDICHERRY,31.0,6.8,7.8,505.0,2.1,0.02,233.0,465.0,2012,2012-07-19
149,2444,CORINGA RIVER,PONDICHERRY,25.0,6.5,7.9,11170.0,3.0,0.3,233.0,465.0,2012,2012-07-20
150,2442,GAUTAMINANGODAVARI RIVER,PONDICHERRY,25.0,6.9,7.4,4990.0,3.0,0.37,233.0,465.0,2012,2012-07-21
151,2443,GAUTAMINANGODAVARI RIVER,PONDICHERRY,25.0,6.8,8.1,1516.0,1.8965,0.28,233.0,465.0,2012,2012-07-23
152,1450,PALAR AT VANIYAMBADI WATER SUPPLY HEAD WORK,TAMILNADU,27.0,6.8,7.5,890.0,2.1,0.51,274.0,589.0,2012,2012-07-24
153,1159,TAMBIRAPARANI AT BDG.NR. MADURA COATS LTD. PAPAVINASAM,TAMILNADU,23.0,7.3,7.6,160.0,1.9,0.06,32.0,89.0,2012,2012-07-25
154,1160,"TAMBIRAPARANI AT CHERANMADEVI,CAUSE WAY",TAMILNADU,25.0,7.0,7.7,111.0,2.2,0.08,53.0,131.0,2012,2012-07-26
155,1161,"TAMBIRAPARANI AT TIRUNELVELI,COLLECTORATE",TAMILNADU,26.0,6.7,7.7,139.0,3.1,0.22,123.0,300.0,2012,2012-07-27
156,1162,TAMBIRAPARANI AT MURAPPANADU,TAMILNADU,29.0,7.2,7.2,288.0,2.1,0.14,33.0,91.0,2012,2012-07-28
157,1328,TAMBIRAPARANI AT PAPPANKULAM,TAMILNADU,24.0,7.0,7.1,95.0,1.9,0.08,47.0,118.0,2012,2012-08-01
158,1329,TAMBIRAPARANI AT RAIL BDG. ,TAMILNADU,24.0,7.0,7.5,84.0,1.7,0.06,32.0,87.0,2012,2012-08-03
159,1330,TAMBIRAPARANI AT ARUMUGANERI,TAMILNADU,29.0,7.4,7.0,3101.0,15.6,0.15,76.0,174.0,2012,2012-08-04
160,3025,"TAMBIRAPARANI AT ERAL, THOTHUKUDI",TAMILNADU,29.0,7.2,7.3,510.0,2.9,0.08,46.0,123.0,2012,2012-08-05
161,3026,"TAMBIRAPARANI AT KALLIDAI KURICHI, TIRUNELVELI",TAMILNADU,24.0,7.1,7.4,88.0,1.8,0.07,34.0,90.0,2012,2012-08-06
162,3027,"TAMBIRAPARANI AT SRIVAIKUNTAM, D/S OF SK ANAICUT, TIRUNELVELI",TAMILNADU,29.0,7.2,6.9,338.0,3.8,0.07,44.0,104.0,2012,2012-08-07
163,3028,"TAMBIRAPARANI AT VELLAKOIL, TIRUNELVELI",TAMILNADU,26.0,6.7,7.6,162.0,3.3,0.16,90.0,249.0,2012,2012-08-08
164,3029,"TAMBIRAPARANI AT SIVALAPERI, CONFLUENCE POINT OF KUTTRALAM FALLS, D/S OF PALAYAMKOTTAI, TIRUNELVELI",TAMILNADU,27.0,6.7,7.6,182.0,4.1,0.15,92.0,251.0,2012,2012-08-10
165,1885,GHAGGAR AT D/S OF SURAJPUR,HARYANA,27.0,6.8,8.0,414.0,3.1,0.88,233.0,465.0,2012,2012-08-11
166,1023,GHAGGAR AT MUBARAKPUR REST HOUSE (PATIALA),PUNJAB,21.0,5.5,7.4,635.0,8.8,5.08,1400.0,5500.0,2012,2012-08-12
167,1024,GHAGGAR AT 100M D/S CONF. WITH R. SARASWATI (PATIALA),PUNJAB,24.0,5.5,7.4,1051.0,25.0,6.8,32000.0,63000.0,2012,2012-08-13
168,1295,"GHAGGAR NEAR BANKARPUR,DERA BASSI",PUNJAB,21.0,5.3,7.3,636.0,9.9,5.0,2150.0,10000.0,2012,2012-08-14
169,1473,"GHAGGAR AT RATANHERI, D/S OF PATIALA NADI (AFTER CONFL.)",PUNJAB,24.0,5.1,7.4,993.0,21.9,6.63,36250.0,57750.0,2012,2012-08-15
170,1698,GHAGGAR AT D/S CHHATBIR,PUNJAB,21.0,5.3,7.5,632.0,13.5,5.08,20000.0,34750.0,2012,2012-08-16
171,1699,GHAGGAR AT U/S DHAKANSU NALLAH,PUNJAB,18.0,4.9,7.4,973.0,17.5,4.77,22000.0,40667.0,2012,2012-08-17
172,1700,GHAGGAR AT D/S DHAKANSU NALLAH,PUNJAB,22.0,4.3,7.5,1156.0,24.5,7.65,33750.0,65000.0,2012,2012-08-18
173,1701,GHAGGAR AT D/S JHARMAL NADI,PUNJAB,22.0,4.8,7.4,904.0,26.0,8.6,31750.0,55000.0,2012,2012-08-19
174,1703,GHAGGAR AT MOONAK,PUNJAB,24.0,5.3,7.4,1290.0,26.9,8.1,36250.0,66250.0,2012,2012-08-20
175,1704,GHAGGAR AT D/S SARDULGARH,PUNJAB,22.0,4.9,7.4,990.0,27.8,6.78,19000.0,40500.0,2012,2012-08-21
176,1705,GHAGGAR AT U/S SARDULGARH,PUNJAB,22.0,5.2,7.4,914.0,20.5,6.18,14750.0,29500.0,2012,2012-08-22
177,1025,"GHAGGAR GHNAN1 AT ROAD BRDG. SIRSA,DEBWALI ROAD",HARYANA,27.0,6.4,7.9,1808.0,21.0,5.9,233.0,465.0,2012,2012-08-23
178,1026,GHAGGAR GHNAN2 AT CHANDARPUR ,HARYANA,27.0,6.6,7.8,1302.0,18.0,0.52,233.0,465.0,2012,2012-08-24
179,1887,GHAGGAR BEFORE OTTU WEIR (BEFORE MIXING OF SATLUJ CANAL ,HARYANA,27.0,6.4,8.0,1286.0,19.5,0.52,233.0,465.0,2012,2012-08-25
180,1718,GAGGAR RIVER WHEN ENTERING IN RAJASTHAN FROM HARYANA NEAR RD NO. 629,RAJASTHAN,33.0,4.8,7.5,280.0,2.4,0.72,3.0,4.0,2012,2012-08-26
181,1871,"RIVER MARKANDA AT PAONTA, DISTT. SIRMOUR",HIMACHAL PRADESH,20.0,7.7,7.4,344.0,1.2,0.37,9.0,19.0,2012,2012-08-27
182,2624,MARKANDA U/S KALA AMB,HIMACHAL PRADESH,20.0,7.3,7.0,310.0,1.4,0.38,13.0,22.0,2012,2012-08-28
183,2625,MARKANDA D/S KALA AMB/ BOUNDARY OF HARYANA,HIMACHAL PRADESH,20.0,7.1,7.7,303.0,1.5,0.34,13.0,23.0,2012,2012-09-01
184,1870,"RIVER SUKHANA AT PARWANOO, DISTT. SOLAN",HIMACHAL PRADESH,18.0,6.2,7.5,788.0,41.5,4.08,105.0,235.0,2012,2012-09-02
185,2947,"JAWAI AT JAWAI DAM, SIROHI",RAJASTHAN,24.0,6.0,8.3,468.0,1.4,0.43,5.0,16.0,2012,2012-09-03
186,1717,"KODRA DAM, MOUNT ABU",RAJASTHAN,19.0,5.9,7.3,234.0,1.5,0.36,4.0,12.0,2012,2012-09-04
187,2948,"BANDI AT HEMAWAS DAM, PAL",RAJASTHAN,23.0,6.4,8.0,527.0,1.2,0.35,5.0,21.0,2012,2012-09-05
188,2949,"RIVER LUNI AT RANAKPUR DAM, RANAKPUR, PALI",RAJASTHAN,24.0,5.9,7.9,796.0,1.5,0.48,4.0,14.0,2012,2012-09-06
189,3305,"BANJAR AT MALANJKHAND NR W/S INTAKE POINT, JABALPUR",MADHYA PRADESH,23.0,7.3,7.4,388.0,2.1,0.58,233.0,46.0,2012,2012-09-07
190,2869,BARAK RIVER AT SENAPATI DISTT,MANIPUR,28.0,8.5,7.5,166.0,2.7,0.52,233.0,31.0,2012,2012-09-08
191,2838,"BARAK RIVER NR NONEY VILL., TAMENGLONG",MANIPUR,29.0,8.9,7.0,125.0,1.9,0.52,233.0,45.0,2012,2012-09-09
192,2868,"CHAKPIAT CHAKPIKARONG, CHANDEL",MANIPUR,30.0,8.0,7.8,144.0,2.1,0.52,233.0,51.0,2012,2012-09-11
193,1424,IMPHAL AT MAHABALI,MANIPUR,30.0,7.5,7.7,87.0,1.2,0.52,233.0,54.0,2012,2012-09-13
194,1457,IMPHAL AT KOIRENGEI,MANIPUR,28.0,8.5,7.6,84.0,2.0,0.52,233.0,16.0,2012,2012-09-15
195,1627,IMPHAL AT KYAMGEI,MANIPUR,29.0,8.4,7.5,103.0,1.9,0.52,233.0,75.0,2012,2012-09-16
196,1628,IMPHAL AT MINUTHONG,MANIPUR,30.0,8.7,7.2,117.0,3.2,0.52,233.0,52.0,2012,2012-09-17
197,2861,"IMPHAL AT KANGLA MOAT, IMPHAL WEST",MANIPUR,29.0,6.5,7.7,287.0,8.2,0.52,233.0,114.0,2012,2012-09-18
198,2862,"IMPHAL AT SAMUROU, IMPHAL WEST",MANIPUR,28.0,8.6,7.5,130.0,4.6,0.52,233.0,39.0,2012,2012-09-19
199,2864,"IMPHAL AT SEKMAI, IMPHAL EAST",MANIPUR,28.0,8.9,7.5,109.0,1.2,0.52,233.0,33.0,2012,2012-09-20
200,2874,IRANG RIVER AT TAMENGLONG ,MANIPUR,30.0,9.8,8.4,246.0,1.2,0.52,233.0,10.0,2012,2012-09-21
201,1458,IRIL AT PORAMPET,MANIPUR,28.0,7.6,7.5,147.0,1.3,0.52,233.0,30.0,2012,2012-09-24
202,1624,IRIL AT LILONG,MANIPUR,29.0,8.7,7.6,202.0,1.2,0.52,233.0,60.0,2012,2012-09-26
203,2863,"IRIL AT KANGLA SIPHAI, IMPHAL EAST",MANIPUR,28.0,8.4,7.4,177.0,2.4,0.52,233.0,48.0,2012,2012-09-27
204,2873,"IRIL RIVER AT LILONG, UKHRUL",MANIPUR,29.0,8.7,7.6,203.0,2.5,0.52,233.0,59.0,2012,2012-09-28
205,2865,"JIRI RIVER AT JIRIMUKH JIRIBAM, IMPHAL EAST",MANIPUR,32.0,8.2,7.4,120.0,1.9,0.52,233.0,46.0,2012,2012-10-01
206,2866,"JIRI RIVER AT JIRI, IMPHAL EAST",MANIPUR,32.0,8.0,7.2,110.0,1.4,0.52,233.0,80.0,2012,2012-10-04
207,1925,KHUGA RIVER (CHURACHANDPUR),MANIPUR,30.0,8.4,7.6,213.0,1.5,0.52,233.0,20.0,2012,2012-10-05
208,2877,"KHUGA DAM ON KHUGA R, CHURACHANDPUR",MANIPUR,29.0,9.4,7.8,174.0,1.0,0.52,233.0,16.0,2012,2012-10-06
209,1926,"KHUJAIROK, MOREH (CHANDEL)",MANIPUR,31.0,8.1,8.0,244.0,2.4,0.52,233.0,73.0,2012,2012-10-08
210,2878,LOKCHAO RIVER AT BISHNUPUR,MANIPUR,29.0,8.1,8.0,162.0,1.8,0.52,233.0,26.0,2012,2012-10-10
211,2867,MAHA RIVER AT CHANDEL,MANIPUR,30.0,8.7,7.6,163.0,2.6,0.52,233.0,24.0,2012,2012-10-11
212,2852,"MANIPUR AT SEKMAIJAN, THOUBAL",MANIPUR,29.0,8.7,7.6,143.0,1.9,0.52,233.0,58.0,2012,2012-10-12
213,2857,MANIPUR RIVER AT THOUBAL,MANIPUR,30.0,9.2,7.6,208.0,1.9,0.52,233.0,30.0,2012,2012-10-15
214,2879,ETHAI BARRAGE ON MANIPUR R AT BISHNUPUR,MANIPUR,29.0,8.3,7.7,158.0,2.0,0.52,233.0,48.0,2012,2012-10-16
215,1625,NAMBUL RIVER AT HUMP BRIDGE,MANIPUR,29.0,5.9,7.1,338.0,6.6,0.52,233.0,522.0,2012,2012-10-17
216,1626,NAMBUL AT HEIRANGOITHONG,MANIPUR,30.0,4.3,7.4,269.0,12.3,0.52,233.0,412.0,2012,2012-10-18
217,2858,"NAMBUL RIVER AT SAMUSANG,IMPHAL WEST",MANIPUR,29.0,8.2,7.1,109.0,3.3,0.52,233.0,12.0,2012,2012-10-19
218,2860,"NAMBUL AT NAOREMTHONG, IMPHAL WEST",MANIPUR,29.0,7.4,7.1,116.0,2.7,0.52,233.0,55.0,2012,2012-10-22
219,2880,NAMBUL RIVER AT BISHNUPUR,MANIPUR,28.0,8.2,7.6,112.0,2.1,0.52,233.0,31.0,2012,2012-10-24
220,1927,"SEKMAI R, KAKCHING (THOUBAL)",MANIPUR,29.0,8.5,7.5,169.0,3.6,0.52,233.0,41.0,2012,2012-10-25
221,2854,"THOUBAL R AT PHADOM, THOUBAL",MANIPUR,29.0,8.9,7.6,221.0,1.7,0.52,233.0,30.0,2012,2012-10-28
222,2856,"THOUBAL RIVER AT YAIRIPOK, THOUBAL",MANIPUR,30.0,9.3,7.6,193.0,2.3,0.52,233.0,41.0,2012,2012-11-01
223,2870,"THOUBAL  AT SHONG KONG, UKHRUL",MANIPUR,28.0,9.1,7.3,217.0,3.9,0.52,233.0,67.0,2012,2012-11-02
224,2871,"THOUBAL  AT YONGUL KONG, UKHRUL",MANIPUR,28.0,7.9,7.3,131.0,0.8,0.52,233.0,38.0,2012,2012-11-03
225,2872,"THOUBAL AT LITAN, UKHRUL",MANIPUR,29.0,8.7,7.4,176.0,2.2,0.52,233.0,36.0,2012,2012-11-04
226,2855,"WANGJING AT HEIROK, THOUBAL",MANIPUR,30.0,8.1,7.3,199.0,2.2,0.52,233.0,56.0,2012,2012-11-05
227,2876,"WANGJING RIVER AT WANGJING, THOUBAL",MANIPUR,30.0,8.2,7.4,170.0,2.2,0.52,233.0,39.0,2012,2012-11-06
228,3383,"BUGI RIVER AT MIBANPARA, SOUTH GARO HILLS",MEGHALAYA,25.0,7.7,7.2,95.0,1.8,2.67,22.0,50.0,2012,2012-11-07
229,3384,"BUGI AT DALU, SOUTH GARO HILLS",MEGHALAYA,25.0,7.6,7.2,92.0,2.5,2.41,20.0,45.0,2012,2012-11-08
230,3380,"DAMRING RIVER (KRISHNEI RIVER) AT RESUBELPARA, EAST GARO HILLS",MEGHALAYA,25.0,9.9,7.2,65.0,1.5,2.31,21.0,55.0,2012,2012-11-09
231,1632,GANOL RIVER TURA,MEGHALAYA,24.0,7.6,7.4,93.0,2.1,2.89,276.0,408.0,2012,2012-11-10
232,3370,"KYNSHI  AT NANGKHNUM, WEST KHASI HILLS",MEGHALAYA,17.0,7.7,7.1,45.0,1.4,2.89,9.0,22.0,2012,2012-11-13
233,3371,"KYNSHI RIVER AT RANIKOR, WEST KHASI HILLS",MEGHALAYA,23.0,8.3,7.0,59.0,1.7,2.86,16.0,33.0,2012,2012-11-14
234,3376,LUKHA RIVER AT SUNAPUR (TRIBUTARY OF LUNAR),MEGHALAYA,25.0,7.7,6.3,250.0,2.1,3.88,180.0,326.0,2012,2012-11-16
235,3381,"MANDA RIVER (DUDHAI RIVER) AT JAMPA, EAST GARO HILLS",MEGHALAYA,25.0,8.8,7.3,37.0,1.5,1.62,15.0,35.0,2012,2012-11-19
