236,3382,"MANDA RIVER (DUDHAI RIVER) AT WAGAISI, EAST GARO HILLS",MEGHALAYA,25.0,7.3,7.3,72.0,2.0,1.65,17.0,36.0,2012,2012-11-20
237,3377,"MYNTANG RIVER AT NARTIANG, JAYANTIA HILLS",MEGHALAYA,20.0,7.5,7.0,38.0,1.7,2.2,18.0,40.0,2012,2012-11-21
238,3378,"MYNTANG RIVER AT MYNSO, JAYANTIA HILLS",MEGHALAYA,22.0,7.8,7.1,44.0,1.6,2.62,15.0,33.0,2012,2012-11-22
239,1631,MYNTDU RIVER JOWAI,MEGHALAYA,20.0,7.0,7.0,100.0,2.4,3.03,1967.0,2600.0,2012,2012-11-23
240,3379,"MYNTDU RIVER AT LESHKA, JAYANTIA HILLS",MEGHALAYA,21.0,7.5,6.3,52.0,1.7,0.82,7.0,21.0,2012,2012-11-24
241,3368,"NONBAH RIVER AT NANGSTOIN MARKE, WEST KHASI HILLS",MEGHALAYA,17.0,7.5,7.1,39.0,1.4,2.88,12.0,22.0,2012,2012-11-25
242,3372,"RILANG AT MAWKYRWAT, WEST KHASI HILLS",MEGHALAYA,17.0,8.0,7.1,41.0,1.4,3.35,10.0,25.0,2012,2012-11-26
243,1633,SIMSANG RIVER WILLIAMNAGAR,MEGHALAYA,24.0,7.9,7.3,93.0,1.7,5.02,295.0,418.0,2012,2012-11-27
244,3353,"UMIAM MAWPHLANG RIVER AT NONGKREM, EAST KHASI HILLS",MEGHALAYA,18.0,7.5,6.9,69.0,1.9,4.92,20.0,49.0,2012,2012-11-28
245,3354,"UMIAM MAWPHLANG RIVER AT UMTYNGNGAR, EAST KHASI HILLS",MEGHALAYA,18.0,7.9,7.2,46.0,1.7,2.72,20.0,45.0,2012,2012-12-01
246,3355,"UMIAM MAWPHLANG RIVER AT MAWPHLANG, EAST KHASI HILLS",MEGHALAYA,18.0,8.0,7.2,42.0,1.4,2.47,5.0,31.0,2012,2012-12-02
247,3356,"UMIAM MAWPHLANG RIVER AT SHELLA, EAST KHASI HILLS",MEGHALAYA,25.0,7.7,7.1,101.0,1.5,3.42,16.0,43.0,2012,2012-12-03
248,3350,UMKHEN AT WAHKDAIT,MEGHALAYA,19.0,7.2,7.1,49.0,1.6,2.86,17.0,40.0,2012,2012-12-04
249,3351,UMKHEN AT KSEHPONGDENG,MEGHALAYA,21.0,8.2,7.1,49.0,1.2,2.81,15.0,32.0,2012,2012-12-05
250,3352,"UMKHEN AT DIENGPASOH, EAST KHASI HILLS",MEGHALAYA,21.0,7.8,7.1,58.0,1.5,2.97,19.0,43.0,2012,2012-12-06
251,3360,"UMKHRAH RIVER ATUMKALIAR, SHILLONG",MEGHALAYA,18.0,4.9,7.1,182.0,14.2,11.61,10417.0,15500.0,2012,2012-12-07
252,3362,"UMKHRAH RIVER AT MAWPDANG, MAWLAI",MEGHALAYA,19.0,2.5,7.1,382.0,37.2,11.81,53083.0,87167.0,2012,2012-12-08
253,3357,"UMNGOT RIVER AT SMIT, EAST KHASI HILLS",MEGHALAYA,18.0,8.0,7.0,48.0,1.4,3.8,17.0,41.0,2012,2012-12-09
254,3358,"UMNGOT RIVER AT DAWKI, EAST KHASI HILLS",MEGHALAYA,24.0,8.4,7.1,48.0,1.2,3.08,18.0,45.0,2012,2012-12-10
255,3363,"UMSHYRPI AT RISA COLONY, EAST KHASI HILLS",MEGHALAYA,17.0,6.8,6.6,49.0,1.9,3.07,18.0,38.0,2012,2012-12-11
256,3365,"UMSHYRPI AT UMSHYRPI BDG, EAST KHASI HILLS",MEGHALAYA,19.0,4.0,7.1,194.0,22.4,10.47,29500.0,45250.0,2012,2012-12-12
257,1427,UMTREW AT BYRNIHAT EAST,MEGHALAYA,24.0,7.7,7.2,107.0,6.6,3.02,285.0,425.0,2012,2012-12-15
258,3366,"UMTREW RIVER AT UMRAN, RINAN BHOI",MEGHALAYA,22.0,7.6,7.1,51.0,2.0,2.6,37.0,81.0,2012,2012-12-17
259,3373,"WAH BLEI AT RIANGDO, WEST KHASI HILLS",MEGHALAYA,20.0,7.7,7.1,46.0,1.6,3.93,8.0,22.0,2012,2012-12-18
260,3374,"WAH BLEI AT SHDADDKHAR, WEST KHASI HILLS",MEGHALAYA,20.0,7.7,7.1,49.0,1.9,3.89,11.0,26.0,2012,2012-12-19
261,2050,TLAWNG UPSTREAM AIZAWL,MIZORAM,24.0,6.5,7.4,297.0,1.0,0.13,26.0,438.0,2012,2012-12-20
262,2051,TLAWNG DOWNSTREAM AIZAWL,MIZORAM,24.0,6.3,7.5,287.0,0.9,0.14,5.0,204.0,2012,2012-12-21
263,2052,TUIRIAL UPPER CATCHMENT,MIZORAM,24.0,6.5,7.2,375.0,1.1,0.17,33.0,625.0,2012,2012-12-22
264,2053,TUIRIAL LOWER CATCHMENT,MIZORAM,24.0,6.9,6.9,349.0,1.1,0.18,38.0,503.0,2012,2012-12-23
265,1403,GUMTI AT U/S SOUTH TRIPURA,TRIPURA,28.0,6.6,7.8,165.0,1.6,0.52,268.0,316.0,2012,2012-12-24
266,1404,GUMTI AT D/S SOUTH TRIPURA,TRIPURA,28.0,6.4,8.0,155.0,3.9,0.5,512.0,516.0,2012,2012-12-25
267,1726,"CHANDRAPUR, AGARTALA D/S OF HAORA RIVER",TRIPURA,27.0,6.5,8.0,168.0,4.2,0.99,488.0,616.0,2012,2012-12-27
268,1150,"DAMANGANGA AT KACHIGAON U\S AT GIDC WIER,GUJARAT",GUJARAT,27.1,7.3,7.9,693.0,0.5,1.0,161.0,173.0,2013,2013-01-01
269,1246,"DAMANGANGA AT KACHIGAON D\S (DAMAN), GUJARAT",GUJARAT,27.3,5.0,7.6,1676.0,1.8,8.0,329.0,174.0,2013,2013-01-02
270,1434,"AMLAKHADI AFTER CONFL. OF W. WATER FROM ANKLESH,GUJARAT",GUJARAT,24.5,6.0,7.7,1863.0,8.6,1.0,47.0,1183.0,2013,2013-01-03
271,1149,"KOLAK AT PATALIA BDG., GUJARAT",GUJARAT,27.5,5.3,7.8,817.0,2.8,1.0,9.0,23.0,2013,2013-01-05
272,1860,BALEHWAR KHADI AT N.H. NO 8,GUJARAT,28.4,4.5,8.3,1287.0,1.5,11.0,116.0,5.0,2013,2013-01-07
273,2082,TRIVENI SANGAM,GUJARAT,27.0,6.7,7.3,198.0,1.8965,0.0,233.0,2.0,2013,2013-01-08
274,1148,"AMBIKA AT BILIMORA, GUJARAT",GUJARAT,27.6,6.8,8.2,1862.0,2.5,0.87,7.0,64.0,2013,2013-01-09
275,3205,"UPSTREAM OF RIVER VISHWAMITRI AT ASOD BRIDGE AT N.H. 8 , NEAR GLDEN CHOKDI, ASOD VEMALI ROAD",GUJARAT,27.0,5.0,8.0,198.0,0.7,0.0,233.0,465.0,2013,2013-01-11
276,3204,"DOWNSTREAM OF RIVER VISHWAMITRI AT KHALIPUR VILLAGE, BEFORE MEETING JAMBUVA RIVER",GUJARAT,27.0,3.0,7.7,198.0,0.4,0.0,233.0,465.0,2013,2013-01-12
277,1862,KAVERI ON BRIDGE AT BILLIMORANANVALSAD ROAD,GUJARAT,27.0,6.7,8.1,2520.0,7.2,1.0,6.0,41.0,2013,2013-01-13
278,2072,RIVER BHOGAVO D/S OF SURENDRANAGAR,GUJARAT,29.0,8.2,8.4,606.0,2.9,0.0,233.0,465.0,2013,2013-01-15
279,,,,27.0,6.7,7.3,198.0,1.8965,0.52,233.0,465.0,2013,2013-01-16
280,1399,"ZUARI AT D/S OF PT. WHERE KUMBARJRIA CANAL JOINS, GOA",GOA,30.0,5.6,7.5,41.0,2.0,0.08,7022.0,13410.0,2013,2013-01-17
281,1475,ZUARI AT PANCHAWADI,GOA,30.4,5.5,6.7,209.0,0.8,0.17,1893.0,2915.0,2013,2013-01-18
282,3181,RIVER ZUARI AT BORIM BRIDGE,GOA,30.8,5.5,7.1,123.0,1.5,0.09,3293.0,6264.0,2013,2013-01-20
283,3182,RIVER ZUARI AT MARCAIM JETTY,GOA,30.3,5.3,7.3,182.0,1.5,0.08,1976.0,3080.0,2013,2013-01-21
284,1400,"MANDOVI AT NEGHBOURHOOD OF PANAJI, GOA",GOA,30.1,6.0,7.6,100.0,1.2,0.17,5129.0,6086.0,2013,2013-01-22
285,1476,"MANDOVI AT TONCA, MARCELA, GOA",GOA,29.9,5.7,6.9,111.0,1.0,0.14,939.0,3061.0,2013,2013-01-25
286,3185,RIVER MANDOVI AT AMONA BRIDGE,GOA,29.1,6.4,7.1,140.0,1.1,0.1,4464.0,7908.0,2013,2013-01-26
287,3186,RIVER MANDOVI AT IFFI JETTY,GOA,29.9,6.2,7.8,44.0,2.0,0.06,9429.0,9320.0,2013,2013-01-27
288,3187,RIVER MANDOVI NEAR HOTEL MARRIOT,GOA,29.8,6.1,7.6,43.0,1.8,0.06,6668.0,9554.0,2013,2013-02-01
289,1543,"RIVER KALNA AT CHANDELNAN PERNEM, GOA",GOA,27.9,7.0,6.9,64.0,1.1,0.09,1641.0,2841.0,2013,2013-02-02
290,1548,"RIVER ASSONORA AT ASSONORA, GOA",GOA,28.2,6.6,6.5,62.0,1.0,0.14,4073.0,7190.0,2013,2013-02-06
291,2276,"RIVER BICHOLIM VARAZAN NAGAR , BICHOLIM",GOA,29.6,7.0,6.8,304.0,2.0,0.49,12140.0,23867.0,2013,2013-02-07
292,2275,"RIVER CHAPORA NEAR ALORNA FORT ,PERNEM",GOA,28.8,7.0,7.0,55.0,1.2,0.66,1298.0,2813.0,2013,2013-02-08
293,3189,RIVER CHAPORA AT SIOLIM,GOA,29.5,6.3,7.6,213.0,1.5,0.06,3803.0,7069.0,2013,2013-02-10
294,1546,"RIVER KHANDEPAR AT OPA NAN PONDA, GOA",GOA,29.8,6.7,6.8,83.0,1.2,0.17,2140.0,3559.0,2013,2013-02-12
295,2270,"RIVER KHANDEPAR AT CODLI NEAR BRIDGE ,U/S OPA WATERWORKS,SANGUEM",GOA,29.7,7.1,6.6,76.0,1.0,0.12,2367.0,3527.0,2013,2013-02-13
296,2272,"RIVER KUSHAWATI NEAR BUND AT KEVONA,RIVON,SANGUEM",GOA,28.7,6.7,6.6,107.0,1.3,0.22,2461.0,3757.0,2013,2013-02-14
297,1545,"RIVER MADAI AT DABOS NAN  VALPOI, GOA",GOA,27.9,7.2,6.7,89.0,0.9,0.06,832.0,1996.0,2013,2013-02-15
298,2274,RIVER MAPUSA ON CULVERT ON HIGHWAY MAPUSANANPANAJI,GOA,29.3,4.2,6.7,192.0,2.0,0.16,4448.0,9286.0,2013,2013-02-17
299,2271,"RIVER SAL PAZORKHONI,CUNCOLIM(NEAR CULVERT MARGAONAN CANACONA NATIONAL HIGHWAY)",GOA,28.6,6.3,6.6,79.0,1.6,0.19,2830.0,6054.0,2013,2013-02-18
300,2273,"RIVER SAL NEAR HOTEL LEELA MOBOR,CAVELOSSIM",GOA,29.8,5.6,7.7,142.0,1.7,0.14,1831.0,3644.0,2013,2013-02-20
301,3183,"RIVER SAL AT KHAREBAND, MARGAO",GOA,28.6,2.8,6.4,424.0,3.2,0.35,12658.0,21036.0,2013,2013-02-21
302,3184,"RIVER SAL AT ORLIM BRIDGE, ORLIM",GOA,30.6,5.2,7.1,306.0,2.6,0.34,1411.0,1525.0,2013,2013-02-22
303,3190,RIVER SINQUERIM (CANDOLIM SIDE NEAR BRIDGE),GOA,30.3,5.6,7.7,40.0,1.5,0.07,4153.0,7130.0,2013,2013-02-23
304,3191,RIVER SINQUERIM NEAR NERUL TEMPLE,GOA,30.4,5.5,7.7,40.0,1.5,0.08,7086.0,12282.0,2013,2013-02-24
305,1547,"RIVER TALPONA AT CANACONA, GOA",GOA,29.6,6.9,6.7,63.0,0.9,0.21,691.0,1132.0,2013,2013-02-25
306,3188,RIVER TIRACOL AT TIRACOL,GOA,29.6,6.3,7.6,227.0,1.7,0.08,3622.0,3612.0,2013,2013-02-26
307,1544,"RIVER VALVANT AT SANKLI NAN BICHOLIM, GOA",GOA,29.5,7.1,6.6,68.0,1.1,0.13,4124.0,8167.0,2013,2013-02-27
308,2651,"AMBA RIVER AT D/S OF WAKEN BRIDGENANU/S OF JS PETROCHEMICALS, WAKENPHATA, ROHA",MAHARASHTRA,26.7,6.9,7.7,121.0,3.3,1.0,77.0,163.0,2013,2013-02-28
309,1461,"BHATSA AT D/S OF PISE DAM NEAR PISE VILLAGE (ULHAS), MAHARASHTRA",MAHARASHTRA,29.3,7.2,8.2,112.0,3.3,1.0,39.0,94.0,2013,2013-03-01
310,2653,"BHATSA RIVER AT D/S OF LIBERTY OIL MILLS, SATNEL, SHAHAPUR, THANE",MAHARASHTRA,28.0,6.9,7.7,103.0,3.7,0.57,48.0,103.0,2013,2013-03-02
311,2654,"BHATSA RIVER AT U/S OF LIBERTY OIL MILLS, SATNEL, SHAHAPUR, THANE",MAHARASHTRA,28.2,6.9,7.6,104.0,3.5,0.75,37.0,79.0,2013,2013-03-04
312,1092,"KALU AT ATALE VILLAGE, MAHARASHTRA",MAHARASHTRA,26.5,6.4,7.4,1003.0,4.3,2.89,524.0,753.0,2013,2013-03-05
313,2670,"KAN RIVER, NEAR SAKRI WATER WORKS, SAKRI, DHULE.",MAHARASHTRA,20.7,6.3,8.3,408.0,2.7,1.58,64.0,157.0,2013,2013-03-06
314,1152,"KUNDALIKA AT ROHA CITY, MAHARASHTRA",MAHARASHTRA,27.2,6.7,7.8,105.0,3.6,1.0,43.0,89.0,2013,2013-03-07
315,2198,KUNDALIKA RIVER AT ARE KHURD ( SALINE ZONE ),MAHARASHTRA,27.5,6.3,7.6,209.0,4.4,1.86,48.0,98.0,2013,2013-03-09
316,2671,"KUNDALIKA RIVER NEAR SALAV BRIDGE (SALINA ZONE), SALAV, ROHA, RAIGAD",MAHARASHTRA,26.0,5.9,7.6,13768.0,5.0,1.79,166.0,300.0,2013,2013-03-10
317,2672,"KUNDALIKA RIVER AT DHATAV AT JACKWELL (DRINKING WATER  PUMPING STATIONNANSWEET ZONE), ROHA",MAHARASHTRA,26.5,7.3,7.7,86.0,3.2,1.0,50.0,93.0,2013,2013-03-11
318,2168,MITHI RIVER,MAHARASHTRA,27.0,3.6,7.4,6487.0,30.5,1.5,534.0,745.0,2013,2013-03-12
319,2676,"MUCHKUNDI RIVER AT  WAKED,RATNAGIRI, NEAR M/S ASAHI INDIA GLASS LTD., LANJA, RATNAGIRI.",MAHARASHTRA,27.3,6.3,8.3,999.0,3.3,1.78,4.0,112.0,2013,2013-03-13
320,1151,"PATALGANGA AT SHILPHATA, MAHARASHTRA",MAHARASHTRA,28.7,7.2,7.7,125.0,3.3,1.0,39.0,89.0,2013,2013-03-14
321,1462,"PATALGANGA NEAR INTAKE OF MIDC W/W, MAHARASHTRA",MAHARASHTRA,28.4,7.1,7.5,127.0,3.4,4.4,17.0,63.0,2013,2013-03-16
322,2685,"PATALGANGA RIVER AT D/S OF KHARPADA BRIDGE, RAIGAD.",MAHARASHTRA,28.7,7.1,7.4,5300.0,38.0,1.0,388.0,667.0,2013,2013-03-17
323,2686,"PATALGANGA RIVER AT VYAL PUMP HOUSE , KHALAPUR, RAIGAD.",MAHARASHTRA,28.7,7.2,7.6,127.0,3.2,1.0,22.0,51.0,2013,2013-03-18
324,2687,"PATALGANGA RIVER AT KHALAPUR PUMPING STATION, KHALAPUR, RAIGAD.",MAHARASHTRA,28.7,7.0,7.6,126.0,3.3,1.0,20.0,63.0,2013,2013-03-20
325,2688,"PATALGANGA RIVER AT SAVROLI BRIDGE, KHALAPUR, RAIGAD.",MAHARASHTRA,28.7,7.2,7.6,126.0,3.4,1.89,29.0,64.0,2013,2013-03-21
326,2689,"PATALGANGA RIVER AT GAGANGIRI MAHARAJ TEMPLE, KHOPOLI, RAIGAD.",MAHARASHTRA,28.7,7.1,7.8,112.0,3.2,0.63,43.0,88.0,2013,2013-03-22
327,2199,SAVITRI RIVER AT OVALE VILLAGE.,MAHARASHTRA,29.3,6.8,7.7,9590.0,3.6,4.57,3.0,124.0,2013,2013-03-23
328,2701,"SAVITRI RIVER JACKWELL AT UPSA KENDRE, NANGALWADI, MAHAD, RAIGAD",MAHARASHTRA,28.3,6.8,7.4,174.0,3.7,2.26,4.0,124.0,2013,2013-03-24
329,2702,"SAVITRI RIVER AT SHEDAV DOH, MAHAD,RAIGAD",MAHARASHTRA,28.7,6.8,7.6,2572.0,3.3,4.22,4.0,118.0,2013,2013-03-25
330,2703,"SAVITRI RIVER AT DADLI BRIDGE, DADLI, MAHAD, RAIGADH",MAHARASHTRA,29.2,6.7,7.8,6030.0,4.4,4.78,4.0,138.0,2013,2013-03-27
331,2704,"SAVITRI RIVER AT MUTHAVALI VILLAGE, MAHAD, RAIGADH",MAHARASHTRA,28.7,6.8,7.7,7207.0,3.9,4.25,3.0,120.0,2013,2013-03-28
332,2706,"SURYA RIVER, U/S OF SURYA DAM, DHAMMI, VIKRAMGAD, THANE",MAHARASHTRA,27.2,6.8,8.1,167.0,3.8,1.0,32.0,85.0,2013,2013-04-01
333,2707,"SURYA RIVER AT MIDC PUMPING STATION, GARVASHET, PALGHAR, THANE",MAHARASHTRA,27.2,6.8,8.0,173.0,3.5,1.0,53.0,98.0,2013,2013-04-03
334,2708,"SURYA RIVER AT INTAKE OF VASAINANVIRAR W/S SCHEME, MASVAN, PALGHAR, THANE",MAHARASHTRA,27.2,7.0,8.0,168.0,3.6,1.0,44.0,83.0,2013,2013-04-04
335,2709,"TANSA RIVER NEAR ROAD BRIDGE, VILLAGE DAKEWALI, WADA, THANE",MAHARASHTRA,28.0,6.9,7.9,131.0,3.5,0.75,41.0,96.0,2013,2013-04-05
336,1094,"ULHAS AT U/S OF BADLAPUR, MAHARASHTRA",MAHARASHTRA,26.2,7.0,7.6,125.0,3.5,0.6,33.0,63.0,2013,2013-04-08
337,2162,ULHAS RIVER ATJAMBHUL WATER WORKS.,MAHARASHTRA,26.2,7.2,7.5,132.0,3.3,0.9,38.0,88.0,2013,2013-04-09
338,2712,"VAITARNA RIVER NEAR ROAD BRIDGE, GANDHARE VILLAGE, WADA, THANE.",MAHARASHTRA,28.2,7.2,7.7,119.0,3.3,1.0,35.0,68.0,2013,2013-04-10
339,2164,VASHISTI RIVER AT U/S OF THREE M PAPER MILLS NEAR M/S MULTIFILMS PLASTIC PVT. LTD. AT KHERDI.,MAHARASHTRA,24.5,6.9,7.5,159.0,2.8,1.0,3.0,82.0,2013,2013-04-11
340,2713,"VASHISHTI RIVER AT D/S OF THREE M PAPER MILLS NEAR CHIPLUN WATER INTAKE JACKWELL, KHERDI, RATNAGIRI",MAHARASHTRA,24.5,6.7,7.7,141.0,3.3,3.0,4.0,90.0,2013,2013-04-12
341,2714,"VASHISHTI RIVER AT U/S OF POPHALI NEAR KONPHANSAWANE BRIDGE, CHIPLUN, RATNAGIRI",MAHARASHTRA,24.5,7.3,7.7,132.0,2.9,2.0,3.0,88.0,2013,2013-04-13
342,1342,"ACHENKOIL AT THUMPAMON, KERALA",KERALA,24.0,6.4,7.3,76.0,1.7,0.62,199.0,788.0,2013,2013-04-15
343,1443,"ACHENKOIL AT CHENNITHULA, KERALA",KERALA,24.9,6.0,7.1,85.0,1.7,0.53,262.0,538.0,2013,2013-04-16
344,3465,"ACHENKOIL AT KALLARAKADAVU, PATHANAMTHITTA",KERALA,24.3,6.3,7.1,69.0,1.3,0.57,248.0,593.0,2013,2013-04-17
345,3466,"ACHENKOIL AT PANDALAM (NEAR AYYAPPA TEMPLE), PATHANAMTHITTA",KERALA,24.8,6.5,7.3,76.0,1.6,0.55,226.0,545.0,2013,2013-04-19
346,2297,R ANCHARAKANDY AT MERUVAMBA,KERALA,26.4,6.7,6.6,60.0,1.2,0.34,228.0,435.0,2013,2013-04-20
347,2319,R ANCHARAKANDY AT MERUVAMBA,KERALA,27.0,7.0,6.6,3544.0,1.5,0.37,208.0,435.0,2013,2013-04-21
348,2286,R AYROOR AT AYROOR BRIDGE,KERALA,26.6,6.7,7.3,51.0,0.8,0.35,547.0,1567.0,2013,2013-04-24
349,2331,R BHARATHAPUZHA AT KUTTIPPURAM,KERALA,28.6,6.9,7.7,107.0,0.7,0.46,255.0,443.0,2013,2013-04-25
350,2332,R BHARATHAPUZHA AT PATTAMBI,KERALA,28.8,6.7,7.9,173.0,0.9,0.56,191.0,426.0,2013,2013-04-26
351,1154,"CHALAKUDY AT PULICKALKANANDAVU, KERALA",KERALA,28.0,5.6,6.9,126.0,1.2,0.67,266.0,990.0,2013,2013-04-27
352,20,"CHALIYAR AT KOOLIMADU, KERALA",KERALA,27.4,7.3,7.4,70.0,0.8,0.31,2984.0,4208.0,2013,2013-05-01
353,21,"CHALIYAR AT CHUNGAPALLY, KERALA",KERALA,27.5,6.9,7.4,12754.0,0.8,0.29,1807.0,2557.0,2013,2013-05-06
354,3464,"CHALIYAR AT NILAMBUR, MALAPPURAM",KERALA,26.8,7.1,7.4,80.0,0.6,0.5,1921.0,2831.0,2013,2013-05-07
355,1572,"CHANDRAGIRI AT PADIYATHADKA, KERALA",KERALA,30.0,7.2,6.9,62.0,1.3,0.11,33.0,150.0,2013,2013-05-08
356,1573,"CHITRAPUZHA AT IRUMPANAM, KERALA",KERALA,28.8,3.4,6.7,2965.0,2.3,1.11,271.0,1236.0,2013,2013-05-09
357,2295,R CORAPUZHA AT KANAYANKODE,KERALA,27.4,6.1,7.2,15871.0,0.9,0.25,1667.0,2975.0,2013,2013-05-10
358,1564,"R ITHIKKARA AT AYUR, KERALA",KERALA,24.8,6.4,7.2,120.0,1.9,0.77,258.0,618.0,2013,2013-05-12
359,2287,R ITHIKKARA AT ITHIKKARA,KERALA,23.6,6.2,7.2,7448.0,2.0,1.01,184.0,483.0,2013,2013-05-13
360,1566,"R KADALUNDI AT THIRURANGADY, KERALA",KERALA,29.8,6.6,6.9,77.0,1.6,0.29,264.0,756.0,2013,2013-05-16
361,2293,R KADALUNDI AT HAJIRAPPALLY,KERALA,30.2,6.8,7.0,72.0,1.7,0.2,249.0,785.0,2013,2013-05-17
362,2337,R KADAMBAYAR AT BRAHMAPURAM,KERALA,28.2,2.9,6.7,305.0,2.2,1.28,403.0,1623.0,2013,2013-05-19
363,2338,R KADAMBAYAR AT MANCKAKADAVU,KERALA,27.7,3.0,6.6,86.0,2.0,0.39,357.0,1319.0,2013,2013-05-21
364,42,"KALLADA AT PERUMTHOTTAMKADAVU, PUNALOOR, KERALA",KERALA,23.9,6.7,7.1,79.0,1.6,0.34,313.0,738.0,2013,2013-05-22
365,3460,"KALPATHI PUZHA AT KALPATHI, PALAKKAD",KERALA,27.8,6.1,7.8,2905.0,1.3,0.54,422.0,997.0,2013,2013-05-23
366,3458,KARAPUZHA DAM AT WAYANAD,KERALA,26.4,6.9,7.4,112.0,0.5,0.35,50.0,67.0,2013,2013-05-24
367,1571,"R KARINGODE AT KAKKADAVU,  KERALA",KERALA,29.6,7.0,6.9,51.0,1.1,0.18,44.0,317.0,2013,2013-05-25
368,1155,"KARAMANA AT MOONNATTUMUKKU, KERALA",KERALA,27.0,3.1,7.2,1416.0,13.2,4.41,2992.0,19917.0,2013,2013-05-27
369,3471,"RIVER KARAMANA AT ARUVIKARA, THIRUVANANTHAPURAM",KERALA,26.3,7.0,7.1,30.0,0.5,0.32,211.0,496.0,2013,2013-06-01
370,2289,R KARUVANNURR AT KARUVANNUR BRIDGE,KERALA,30.0,6.1,7.0,59.0,1.8,0.58,89.0,282.0,2013,2013-06-03
371,2301,R KAVVAI AT KUTTIYOL PALAM,KERALA,28.0,6.0,6.4,61.0,2.1,0.28,87.0,300.0,2013,2013-06-04
372,2291,R KEECHERI AT VADAKKANCHERY BRIDGE,KERALA,30.1,6.3,7.0,105.0,2.8,0.37,142.0,543.0,2013,2013-06-05
373,2326,R KORAYAR AT KANJIKODE,KERALA,27.9,6.9,8.1,502.0,0.9,0.72,382.0,615.0,2013,2013-06-06
374,1569,"R KUPPAM AT THALIPARAMBA, KERALA",KERALA,27.0,5.9,6.7,14662.0,1.5,0.52,144.0,377.0,2013,2013-06-07
375,2298,R KUPPAM AT RAYAROM,KERALA,26.0,7.8,6.8,49.0,1.4,0.3,122.0,319.0,2013,2013-06-08
376,1567,"R KUTTIYADE AT KUTTIYADY ESTATE, KERALA",KERALA,27.7,7.1,7.4,380.0,1.0,0.14,1527.0,66382.0,2013,2013-06-09
377,1568,"R MAHE AT VALAYAM, KERALA",KERALA,27.1,7.3,7.2,67.0,0.9,0.38,6490.0,3471.0,2013,2013-06-11
378,2285,R MAMOM AT MAMOM BRIDGE,KERALA,26.5,6.2,7.2,51.0,0.8,0.23,331.0,942.0,2013,2013-06-13
379,1340,"MANIMALA  AT KALLOOPARA, KERALA",KERALA,28.5,7.2,6.8,69.0,1.2,0.45,706.0,941.0,2013,2013-06-14
380,1384,"MANIMALA AT THONDRA, KERALA",KERALA,28.7,6.9,6.7,75.0,2.5,0.4,526.0,701.0,2013,2013-06-15
381,3459,"MANIYANKODE PUZHA AT MANIYANKODE BRIDGE, WAYANAD",KERALA,25.7,6.3,7.4,113.0,0.6,0.88,98.0,128.0,2013,2013-06-17
382,2307,R MANJESWAR AT BAJRAKKARA BR.,KERALA,29.3,7.6,6.8,79.0,1.6,0.31,48.0,109.0,2013,2013-06-18
383,1339,"MEENACHIL AT KIDANGOOR, KERALA",KERALA,27.0,7.0,7.2,57.0,0.6,0.46,2117.0,3558.0,2013,2013-06-19
384,43,"MUVATTAPUZHA AT VETTIKKATTUMUKKU, KERALA",KERALA,27.1,6.8,7.2,105.0,0.6,0.39,1200.0,2392.0,2013,2013-06-20
385,2302,R NEELASWARAM AT NAMBIARKAL DAM,KERALA,30.3,6.3,6.7,2315.0,1.3,0.17,55.0,278.0,2013,2013-06-21
386,1570,"R NEELESWARAM AT HOSDURG, KERALA",KERALA,30.4,6.4,6.9,18569.0,1.0,0.27,40.0,277.0,2013,2013-06-22
387,1563,"R NEYYAR AT AMARAVILA, KERALA",KERALA,26.2,6.6,7.3,45.0,0.6,0.39,228.0,940.0,2013,2013-06-23
388,2284,R NEYYAR AT ARUVIPURAM,KERALA,26.2,6.9,7.2,42.0,0.5,0.18,151.0,774.0,2013,2013-06-24
389,2288,R PALLICKAL AT NELLIMUKAL,KERALA,25.1,6.0,7.3,92.0,1.7,0.56,256.0,597.0,2013,2013-06-27
390,1156,"PAMBA AT CHENGANNUR, KERALA",KERALA,27.4,6.1,7.2,59.0,0.7,1.04,181.0,311.0,2013,2013-07-01
391,1341,"PAMBA AT THAKAZHY, KERALA",KERALA,28.1,4.5,6.9,1190.0,0.7,1.17,218.0,388.0,2013,2013-07-02
392,1565,"PAMBA DOWN, KERALA",KERALA,28.3,4.2,7.0,69.0,0.6,1.04,240.0,420.0,2013,2013-07-04
393,17,"PERIYAR NEAR ALWAYENANELOOR, KERALA",KERALA,28.2,6.0,7.0,5569.0,2.2,0.68,473.0,1894.0,2013,2013-07-05
394,18,"PERIYAR AT KALADY, KERALA",KERALA,27.2,7.3,7.0,34.0,1.0,0.27,234.0,927.0,2013,2013-07-07
395,1338,"PERIYAR AT SEWAGE DISCHARGE POINT, KERALA",KERALA,27.4,6.3,7.0,44.0,1.6,0.32,487.0,1876.0,2013,2013-07-09
396,2333,RIVER PERIYAR AT MUPPATHADAM,KERALA,28.2,6.4,7.2,49.0,1.4,0.23,362.0,1357.0,2013,2013-07-10
397,2334,RIVER PERIYAR AT PATHALAM,KERALA,27.9,5.9,7.0,3272.0,2.2,0.62,330.0,1284.0,2013,2013-07-11
398,2335,R PERIYAR AT KALAMASSERY,KERALA,27.3,4.6,7.0,65.0,1.7,0.28,631.0,1937.0,2013,2013-07-13
399,2336,R PERIYAR AT PURAPPALLIKAVU,KERALA,28.2,6.5,6.9,4650.0,2.0,1.0,340.0,1573.0,2013,2013-07-16
400,3468,"PERIYAR AT KWA INTAKENAN ALUVA, ERNAKULAM",KERALA,28.2,6.5,7.0,42.0,1.4,1.0,249.0,1221.0,2013,2013-07-17
401,2300,R PERUVAMBA AT CHANDAPPURA,KERALA,26.7,6.4,6.4,45.0,1.2,1.0,142.0,376.0,2013,2013-07-19
402,2303,R PULLUR AT PULLUR BR.,KERALA,28.0,6.0,6.1,56.0,1.2,0.0,136.0,438.0,2013,2013-07-20
403,2290,R PUZHACKAL AT PUZHACKAL BRIDGE,KERALA,29.7,5.3,6.8,99.0,2.8,0.79,106.0,523.0,2013,2013-07-21
404,2305,R SHRIYA AT ANGADIMOGARU,KERALA,28.9,6.9,6.7,66.0,1.8,0.0,93.0,205.0,2013,2013-07-23
405,2296,R THALLASSERY AT PATHIPPALAM,KERALA,26.4,6.0,6.6,67.0,1.5,3.69,168.0,398.0,2013,2013-07-24
406,2292,R THIRUR AT THALAKKADATHUR BRIDGE,KERALA,30.0,4.9,6.8,9107.0,1.6,1.0,208.0,614.0,2013,2013-07-25
407,3473,"RIVER VALAPATTANAM AT PARASSINIKADAVU, KANNUR",KERALA,27.8,6.6,6.8,15525.0,1.1,0.06,149.0,347.0,2013,2013-07-27
408,1442,"VAMANAPURAM, KERALA",KERALA,26.7,7.1,7.5,46.0,0.8,1.0,239.0,1097.0,2013,2013-07-28
409,1448,"NAGAVALLI AT THOTAPALLI REGULATOR, A.P.",ANDHRA PRADESH,27.0,6.0,7.3,432.0,1.2,3.0,3.0,78.0,2013,2013-08-01
410,2352,"RIVER VAMSHADHARA, KALINGAPATNAM,VIZIANAGARAM",ANDHRA PRADESH,26.8,6.1,7.7,328.0,1.2,1.0,3.0,211.0,2013,2013-08-02
411,3080,"U/S OF KARAKAVAGU AT PALONCHA,  KHAMMAM, A.P.",ANDHRA PRADESH,19.0,5.8,7.8,707.0,0.6,0.85,2.0,1100.0,2013,2013-08-04
412,3081,"D/S OF KARAKAVAGU AT PALONCHA,  KHAMMAM, A.P.",ANDHRA PRADESH,21.4,6.1,8.0,674.0,0.9,1.0,2.0,1260.0,2013,2013-08-05
413,1444,"KALI AT D/S WEST COAST PAPER MILL, KARNATAKA",KARNATAKA,27.1,7.3,7.3,164.0,2.3,1.0,115.0,336.0,2013,2013-08-06
414,2780,"KALI AT U/S OF WCPM, DANDELI, KARNATAKA",KARNATAKA,26.3,7.6,7.4,122.0,2.4,1.0,223.0,834.0,2013,2013-08-08
415,1894,KUMARADHARA NAN U/S OF UPPINAGADY TOWN BEFORE CONFLUENCE WITH RIVER NETHRAVATHI,KARNATAKA,28.3,6.5,7.1,95.0,1.0,0.0,156.0,212.0,2013,2013-08-09
416,1892,NETRAVATHI U/S OF DHARMASTALA AT WATER SUPPLY INTAKE POINT,KARNATAKA,27.9,6.5,7.1,56.0,1.0,0.0,30.0,79.0,2013,2013-08-12
417,2423,"BUDHABALANGA, D/S OF BARIPADA TOWN",ORISSA,23.4,7.5,7.8,237.0,1.4,0.89,8281.0,18918.0,2013,2013-08-13
418,2424,BUDHABALANGA AT BALASORE D/S,ORISSA,23.5,7.6,7.6,3688.0,2.3,2.66,19264.0,32918.0,2013,2013-08-15
419,2425,"RIVER KERANDI(INTAKE WELL OF NALCO REFINARY, HAL, SUNABEDA)",ORISSA,22.4,7.3,7.5,82.0,1.2,1.58,15816.0,17512.0,2013,2013-08-18
420,2422,"NAGAVALLI AT PENTA U/S, JAYKAYPUR TOWN",ORISSA,26.8,7.5,8.0,202.0,1.4,1.89,11771.0,23191.0,2013,2013-08-19
421,1642,"NAGAVALLI AT JAYKAYPUR D/S, ORISSA",ORISSA,26.5,7.3,7.9,232.0,2.9,2.23,9026.0,30836.0,2013,2013-08-20
422,1643,"NAGAVALLI AT RAYAGADA D/S, ORISSA",ORISSA,22.0,7.4,7.9,246.0,2.3,1.9,1850.0,3900.0,2013,2013-08-21
423,1455,"RUSHIKULYA AT GANJAM U/S, ORISSA",ORISSA,27.6,6.9,8.1,3960.0,2.0,2.26,19058.0,22523.0,2013,2013-08-23
424,2426,VANSADHARA AT MUNIGUDA (D/S OF M/S VEDANTAALUMINA PROJECT),ORISSA,25.6,7.2,7.8,201.0,1.3,1.59,29937.0,31034.0,2013,2013-08-25
425,2427,VANSADHARA ATGUNUPUR (INTERSTATE BOUNDRY),ORISSA,26.5,7.3,8.0,221.0,1.2,2.26,16103.0,5289.0,2013,2013-08-26
426,1685,"ARASALAR RIVER KARAIKAL REGION, PONDICHERRY",PONDICHERRY,24.0,6.7,7.8,198.0,1.0,1.0,233.0,465.0,2013,2013-08-27
427,2442,GAUTAMINANGODAVARI RIVER,PONDICHERRY,28.0,8.0,7.7,401.0,1.8965,1.0,233.0,465.0,2013,2013-08-28
428,2443,GAUTAMINANGODAVARI RIVER,PONDICHERRY,28.0,8.0,8.2,1886.0,4.0,1.0,233.0,465.0,2013,2013-09-01
429,2444,CORINGA RIVER,PONDICHERRY,28.0,7.0,8.2,742.0,5.0,1.0,233.0,465.0,2013,2013-09-02
430,2445,MAHE RIVER,PONDICHERRY,27.0,7.0,6.4,149.0,4.0,1.0,233.0,465.0,2013,2013-09-03
431,1450,"PALAR AT VANIYAMBADI WATER SUPPLY HEAD WORK, TAMILNADU",TAMILNADU,27.8,6.7,7.5,1088.0,1.7,0.0,194.0,474.0,2013,2013-09-04
432,1159,"TAMBIRAPARANI AT BDG.NR. MADURA COATS LTD.PAPAVINASAM,TAMILNADU",TAMILNADU,23.4,7.2,6.5,73.0,3.1,0.0,19.0,59.0,2013,2013-09-06
433,1160,"TAMBIRAPARANI AT CHERANMADEVI,CAUSE WAY,TAMILNADU",TAMILNADU,25.4,6.7,6.3,98.0,3.3,1.5,21.0,74.0,2013,2013-09-07
434,1161,"TAMBIRAPARANI AT TIRUNELVELI,COLLECTORATE,TAMILNADU.",TAMILNADU,26.3,6.3,6.5,143.0,4.0,4.0,38.0,124.0,2013,2013-09-09
435,1162,"TAMBIRAPARANI AT MURAPPANADU, TAMILNADU",TAMILNADU,29.0,6.6,6.9,260.0,5.4,1.0,17.0,53.0,2013,2013-09-10
436,1328,"TAMBIRAPARANI AT PAPPANKULAM,TAMILNADU",TAMILNADU,24.6,7.1,6.3,71.0,3.5,1.0,24.0,82.0,2013,2013-09-11
437,1329,"TAMBIRAPARANI AT RAIL BDG. NR. AMBASAMUDAM, TAMILNADU",TAMILNADU,23.5,6.9,6.3,65.0,3.5,0.0,17.0,52.0,2013,2013-09-13
438,1330,"TAMBIRAPARANI AT ARUMUGANERI, TAMILNADU",TAMILNADU,29.0,7.3,7.1,607.0,3.6,0.88,33.0,104.0,2013,2013-09-14
439,3025,"TAMBIRAPARANI AT ERAL, THOTHUKUDI, TAMILNADU",TAMILNADU,27.0,6.1,7.0,446.0,5.2,0.56,26.0,77.0,2013,2013-09-15
440,3026,"TAMBIRAPARANI AT KALLIDAI KURICHI, TIRUNELVELI, TAMILNADU",TAMILNADU,24.0,6.9,6.4,94.0,3.2,1.59,20.0,65.0,2013,2013-09-17
441,3027,"TAMBIRAPARANI AT SRIVAIKUNTAM, D/S OF SK ANAICUT, TIRUNELVELI, TAMILNADU",TAMILNADU,28.7,6.8,6.8,451.0,9.4,0.55,22.0,58.0,2013,2013-09-18
442,3028,"TAMBIRAPARANI AT VELLAKOIL, TIRUNELVELI, TAMILNADU",TAMILNADU,26.3,6.0,6.6,169.0,3.9,2.0,22.0,84.0,2013,2013-09-19
443,3029,"TAMBIRAPARANI AT SIVALAPERI, CONFLUENCE POINT OF KUTTRALAM FALLS, D/S OF PALAYAMKOTTAI, TIRUNELVELI, TAMILNADU",TAMILNADU,25.7,6.5,6.7,187.0,3.3,3.0,32.0,113.0,2013,2013-09-20
444,,,,27.0,6.7,7.3,198.0,1.8965,0.52,233.0,465.0,2013,2013-09-21
445,1023,"GHAGGAR AT MUBARAKPUR REST HOUSE (PATIALA), PUNJAB",PUNJAB,23.3,5.5,7.2,636.0,9.7,4.0,1328.0,4975.0,2013,2013-09-22
446,1024,"GHAGGAR AT 100M D/S CONF. WITH R. SARASWATI (PATIALA),PUNJAB",PUNJAB,22.8,4.7,7.3,1088.0,23.8,4.0,28250.0,56000.0,2013,2013-09-23
447,1295,"GHAGGAR NEAR BANKARPUR,DERA BASSI,PUNJAB",PUNJAB,23.3,5.3,7.2,689.0,11.3,4.0,1350.0,6025.0,2013,2013-09-24
448,1473,"GHAGGAR AT RATANHERI, D/S OF PATIALA NADI (AFTER CONFL.), PUNJAB",PUNJAB,21.8,4.9,7.3,1267.0,23.5,3.0,24750.0,54250.0,2013,2013-09-26
449,1698,"D/S CHHATBIR, PUNJAB",PUNJAB,24.3,5.3,7.4,852.0,13.0,4.0,13775.0,26750.0,2013,2013-09-28
450,1699,"U/S DHAKANSU NALLAH, PUNJAB",PUNJAB,23.5,4.9,7.5,977.0,16.5,5.0,12375.0,30500.0,2013,2013-10-01
451,1700,"D/S DHAKANSU NALLAH, PUNJAB",PUNJAB,24.0,4.4,7.4,1256.0,24.8,6.0,25250.0,55250.0,2013,2013-10-03
452,1701,"D/S JHARMAL NADI, PUNJAB",PUNJAB,23.5,4.8,7.2,1021.0,20.3,4.0,22875.0,43700.0,2013,2013-10-04
453,1702,"U/S JHARMAL NADI, PUNJAB",PUNJAB,23.3,5.1,7.3,971.0,14.8,5.0,2125.0,8425.0,2013,2013-10-06
454,1703,"GHAGGER AT MOONAK, PUNJAB",PUNJAB,22.5,4.6,7.4,1284.0,24.3,4.0,21500.0,50000.0,2013,2013-10-07
455,1704,"D/S SARDULGARH, PUNJAB",PUNJAB,26.0,4.0,7.4,1096.0,26.0,3.0,31750.0,57500.0,2013,2013-10-08
456,1705,"U/S SARDULGARH, PUNJAB",PUNJAB,25.8,4.4,7.3,1002.0,21.5,4.0,21000.0,43750.0,2013,2013-10-10
457,1025,"GHAGGAR GHNAN1 AT ROAD BRDG. SIRSA,DEBWALI ROAD,HARYANA",HARYANA,27.0,6.7,6.9,910.0,13.0,0.0,233.0,465.0,2013,2013-10-11
458,1026,"GHAGGAR GHNAN2 AT CHANDARPUR SYPHON,  HARYANA",HARYANA,27.0,6.7,6.5,930.0,15.0,0.0,233.0,465.0,2013,2013-10-12
459,1884,RIVER GHAGGAR AT D/S OF SURAJPUR,HARYANA,27.0,5.0,7.3,198.0,33.9,0.0,233.0,465.0,2013,2013-10-13
460,1887,GHAGGAR BEFORE OTTU WEIR (BEFORE MIXING OF SATLUJ CANAL WATER) (HARYANA),HARYANA,27.0,6.7,6.7,960.0,18.0,0.0,233.0,465.0,2013,2013-10-14
461,1718,"GAGGAR RIVER WHEN ENTERING IN RAJASTHAN FROM HARYANA NEAR RD NO. 629, RAJASTHAN",RAJASTHAN,30.7,4.8,7.6,295.0,0.8,0.0,4.0,9.0,2013,2013-10-15
