462,1871,"RIVER MARKANDA AT PAONTA, DISTT. SIRMOUR, H.P.",HIMACHAL PRADESH,20.3,7.1,7.5,293.0,1.3,0.0,9.0,19.0,2013,2013-10-16
463,2624,MARKANDA U/S KALA AMB,HIMACHAL PRADESH,20.7,7.1,7.5,316.0,1.4,0.0,13.0,22.0,2013,2013-10-17
464,2625,MARKANDA D/S KALA AMB/ BOUNDARY OF HARYANA,HIMACHAL PRADESH,20.8,6.6,7.5,274.0,1.6,0.0,14.0,24.0,2013,2013-10-18
465,1870,"RIVER SUKHANA AT PARWANOO, DISTT. SOLAN, H.P.",HIMACHAL PRADESH,20.6,4.9,7.4,407.0,16.3,0.0,51.0,120.0,2013,2013-10-19
466,2947,"RIVER JAWAI AT JAWAI DAM, SIROHI, RAJASTHAN",RAJASTHAN,28.0,4.9,8.3,603.0,1.0,0.0,4.0,5.0,2013,2013-10-20
467,1717,"KODRA DAM, MOUNT ABU, RAJASTHAN",RAJASTHAN,23.4,5.5,7.4,138.0,0.8,0.0,4.0,6.0,2013,2013-10-21
468,2948,"RIVER BANDI AT HEMAWAS DAM, PALI, RAJASTHAN",RAJASTHAN,25.3,5.5,8.1,625.0,1.1,0.0,4.0,6.0,2013,2013-10-24
469,1719,"GAGGAR RIVER D/S HANUMANGARH NEAR 2 KNJ NAI ABADI, MAKKASR, RAJASTHAN",RAJASTHAN,31.1,5.0,7.3,305.0,1.7,0.0,4.0,12.0,2013,2013-10-25
470,2949,"RIVER LUNI AT RANAKPUR DAM, RANAKPUR, PALI, RAJASTHAN",RAJASTHAN,26.3,5.6,8.1,552.0,1.1,0.0,4.0,6.0,2013,2013-10-26
471,3305,"RIVER BANJAR AT MALANJKHAND NEAR W/S INTAKE POINT, JABALPUR",MADHYA PRADESH,22.0,7.3,7.3,402.0,2.1,0.0,4.0,32.0,2013,2013-10-27
472,3383,"BUGI RIVER AT MIBANPARA, SOUTH GARO HILLS",MEGHALAYA,24.4,7.2,7.3,99.0,2.2,1.0,26.0,57.0,2013,2013-11-01
473,3384,"BUGI RIVER AT DALU, SOUTH GARO HILLS",MEGHALAYA,23.7,7.2,7.4,102.0,2.2,1.0,25.0,56.0,2013,2013-11-02
474,3380,"DAMRING RIVER (KRISHNEI RIVER) AT RESUBELPARA, EAST GARO HILLS",MEGHALAYA,24.6,7.6,7.2,72.0,1.8,2.56,24.0,57.0,2013,2013-11-04
475,1632,"GANOL RIVER TURA, MEGHALAYA",MEGHALAYA,23.1,7.1,7.5,131.0,2.2,3.2,239.0,413.0,2013,2013-11-05
476,3369,"KYNSHI RIVER AT SOHIONG, WEST KHASI HILLS",MEGHALAYA,18.2,7.3,7.1,47.0,1.3,2.0,15.0,48.0,2013,2013-11-07
477,3370,"KYNSHI RIVER AT NANGKHNUM, WEST KHASI HILLS",MEGHALAYA,18.8,7.6,7.2,52.0,1.2,2.0,16.0,36.0,2013,2013-11-08
478,3371,"KYNSHI RIVER AT RANIKOR, WEST KHASI HILLS",MEGHALAYA,23.8,8.0,6.9,64.0,1.8,3.38,23.0,49.0,2013,2013-11-09
479,3372,RILANG RIVER,MEGHALAYA,17.8,7.9,7.3,46.0,1.4,1.0,12.0,29.0,2013,2013-11-10
480,3373,WAH BLEI,MEGHALAYA,18.7,7.4,7.2,53.0,1.9,3.0,14.0,32.0,2013,2013-11-11
481,3374,WAH BLEI,MEGHALAYA,18.8,7.7,7.2,55.0,1.6,3.0,15.0,63.0,2013,2013-11-13
482,3376,LUKHA RIVER,MEGHALAYA,22.6,7.1,6.5,237.0,3.8,4.56,674.0,1072.0,2013,2013-11-14
483,3381,"MANDA RIVER (DUDHAI RIVER) AT JAMPA, EAST GARO HILLS",MEGHALAYA,25.2,7.8,7.2,50.0,1.6,1.77,20.0,41.0,2013,2013-11-17
484,3382,"MANDA RIVER (DUDHAI RIVER) AT WAGAISI, EAST GARO HILLS",MEGHALAYA,24.8,7.3,7.3,71.0,2.0,2.66,21.0,47.0,2013,2013-11-18
485,3377,"MYNTANG RIVER AT NARTIANG, JAYANTIA HILLS",MEGHALAYA,19.9,7.3,7.0,91.0,1.8,3.3,20.0,45.0,2013,2013-11-20
486,3378,"MYNTANG RIVER AT MYNSO, JAYANTIA HILLS",MEGHALAYA,20.7,7.4,7.1,49.0,1.7,2.44,19.0,42.0,2013,2013-11-22
487,1631,"MYNTDU RIVER JOWAI, MEGHALAYA",MEGHALAYA,20.6,6.5,7.1,99.0,2.7,3.56,1967.0,2722.0,2013,2013-11-24
488,3379,"MYNTDU RIVER AT LESHKA, JAYANTIA HILLS",MEGHALAYA,21.5,7.5,5.7,50.0,1.5,2.21,10.0,23.0,2013,2013-11-25
489,3367,"NONBAH RIVER AT NANGSTOIN MARKE, WEST KHASI HILLS",MEGHALAYA,17.7,5.8,6.9,68.0,3.1,4.9,197.0,463.0,2013,2013-11-26
490,3368,"NONBAH RIVER AT NANGSTOIN MARKE, WEST KHASI HILLS",MEGHALAYA,17.9,6.9,7.2,44.0,1.4,2.66,14.0,33.0,2013,2013-11-27
491,1633,"SIMSANG RIVER WILLIAMNAGAR, MEGHALAYA",MEGHALAYA,23.9,7.8,7.3,93.0,1.9,2.99,264.0,444.0,2013,2013-11-28
492,3353,"UMIAM MAWPHLANG RIVER AT NONGKREM, EAST KHASI HILLS",MEGHALAYA,18.0,6.6,7.0,66.0,2.3,4.0,29.0,63.0,2013,2013-12-02
493,3354,"UMIAM MAWPHLANG RIVER AT UMTYNGNGAR, EAST KHASI HILLS",MEGHALAYA,18.4,7.6,7.1,53.0,1.7,3.0,23.0,53.0,2013,2013-12-03
494,3355,"UMIAM MAWPHLANG RIVER AT MAWPHLANG, EAST KHASI HILLS",MEGHALAYA,18.8,7.8,7.0,47.0,1.4,2.0,8.0,35.0,2013,2013-12-04
495,3356,"UMIAM MAWPHLANG RIVER AT SHELLA, EAST KHASI HILLS",MEGHALAYA,24.8,7.7,7.4,128.0,1.6,3.32,25.0,56.0,2013,2013-12-06
496,3350,UMKHEN AT WAHKDAIT,MEGHALAYA,19.3,7.1,7.0,54.0,1.8,2.58,20.0,43.0,2013,2013-12-07
497,3351,UMKHEN AT KSEHPONGDENG,MEGHALAYA,20.6,7.4,7.0,69.0,1.6,3.3,17.0,87.0,2013,2013-12-08
498,3352,"UMKHEN RIVER AT DIENGPASOH, EAST KHASI HILLS",MEGHALAYA,20.7,7.5,7.2,58.0,1.6,2.25,21.0,46.0,2013,2013-12-09
499,3357,"UMNGOT RIVER AT SMIT, EAST KHASI HILLS",MEGHALAYA,17.6,7.2,6.9,55.0,1.7,3.04,26.0,56.0,2013,2013-12-12
500,3358,"UMNGOT RIVER AT DAWKI, EAST KHASI HILLS",MEGHALAYA,22.7,7.9,7.1,55.0,1.2,3.55,23.0,50.0,2013,2013-12-13
501,3363,"UMSHYRPI RIVER AT RISA COLONY, EAST KHASI HILLS",MEGHALAYA,17.9,6.9,6.9,52.0,2.2,3.48,1576.0,45.0,2013,2013-12-15
502,3365,"UMSHYRPI RIVER AT UMSHYRPI BRIDGE, EAST KHASI HILLS",MEGHALAYA,19.4,4.5,7.1,196.0,15.5,11.0,48611.0,43333.0,2013,2013-12-16
503,1427,"UMTREW AT BYRNIHAT EAST, MEGHALAYA",MEGHALAYA,23.7,7.2,7.1,107.0,6.7,5.56,303.0,476.0,2013,2013-12-18
504,3366,"UMTREW RIVER AT UMRAN, RINAN BHOI",MEGHALAYA,22.7,7.5,7.0,82.0,2.1,3.02,45.0,122.0,2013,2013-12-19
505,2050,TLAWNG UPSTREAM AIZAWL,MIZORAM,23.6,7.1,7.5,189.0,1.9,1.0,233.0,465.0,2013,2013-12-20
506,2051,TLAWNG DOWNSTREAM AIZAWL,MIZORAM,23.8,7.0,7.6,197.0,1.8,1.0,233.0,465.0,2013,2013-12-21
507,2052,TUIRIAL UPPER CATCHMENT,MIZORAM,23.5,7.2,7.9,158.0,1.9,0.95,233.0,465.0,2013,2013-12-22
508,2053,TUIRIAL LOWER CATCHMENT,MIZORAM,23.5,6.5,7.8,161.0,1.8,0.99,233.0,465.0,2013,2013-12-23
509,1403,"GUMTI AT U/S SOUTH TRIPURA,TRIPURA",TRIPURA,27.4,6.6,7.7,165.0,1.7,0.0,280.0,325.0,2013,2013-12-25
510,1404,"GUMTI AT D/S SOUTH TRIPURA, TRIPURA",TRIPURA,21.9,6.7,7.8,167.0,4.8,1.0,440.0,520.0,2013,2013-12-26
511,1726,"CHANDRAPUR, AGARTALA D/S OF HAORA RIVER, TRIPURA",TRIPURA,27.5,6.6,7.7,183.0,3.7,1.55,415.0,575.0,2013,2013-12-28
512,1393,"DAMANGANGA AT D/S OF MADHUBAN, DAMAN",DAMAN & DIU,30.6,6.7,7.5,203.0,1.8965,0.1,11.0,27.0,2014,2014-01-02
513,1399,"ZUARI AT D/S OF PT. WHERE KUMBARJRIA CANAL JOINS, GOA",GOA,29.8,5.7,7.2,189.0,2.0,0.2,4953.0,8391.0,2014,2014-01-03
514,1475,ZUARI AT PANCHAWADI,GOA,29.5,6.3,6.9,179.0,1.7,0.1,3243.0,5330.0,2014,2014-01-04
515,3181,RIVER ZUARI AT BORIM BRIDGE,GOA,29.7,5.8,6.9,64.0,3.8,0.5,5382.0,8443.0,2014,2014-01-05
516,3182,RIVER ZUARI AT MARCAIM JETTY,GOA,29.5,5.8,7.3,83.0,1.9,0.4,3428.0,5500.0,2014,2014-01-06
517,1400,"MANDOVI AT NEGHBOURHOOD OF PANAJI, GOA",GOA,30.0,5.5,7.4,81.0,1.5,0.1,2853.0,4049.0,2014,2014-01-07
518,1476,"MANDOVI AT TONCA, MARCELA, GOA",GOA,29.2,6.1,6.7,308.0,1.4,0.3,3355.0,5672.0,2014,2014-01-08
519,3185,RIVER MANDOVI AT AMONA BRIDGE,GOA,29.6,6.4,6.7,414.0,1.0,0.2,6073.0,9423.0,2014,2014-01-10
520,3186,RIVER MANDOVI AT IFFI JETTY,GOA,30.0,6.4,7.6,305.0,2.2,0.1,3478.0,4990.0,2014,2014-01-12
521,3187,RIVER MANDOVI NEAR HOTEL MARRIOT,GOA,30.1,6.3,7.6,77.0,2.3,0.1,2606.0,4301.0,2014,2014-01-13
522,1543,"RIVER KALNA AT CHANDELNAN PERNEM, GOA",GOA,27.8,7.1,7.1,176.0,1.2,0.1,4573.0,7817.0,2014,2014-01-14
523,1548,"RIVER ASSONORA AT ASSONORA, GOA",GOA,27.9,6.7,6.4,93.0,1.4,0.1,2147.0,3433.0,2014,2014-01-15
524,2276,"RIVER BICHOLIM VARAZAN NAGAR , BICHOLIM",GOA,29.3,7.4,6.8,121.0,1.7,0.4,11633.0,18125.0,2014,2014-01-17
525,2275,"RIVER CHAPORA NEAR ALORNA FORT ,PERNEM",GOA,29.2,6.9,7.0,620.0,1.1,0.1,3500.0,6300.0,2014,2014-01-21
526,3189,RIVER CHAPORA AT SIOLIM,GOA,30.0,6.0,7.5,72.0,1.6,0.2,4995.0,9517.0,2014,2014-01-23
527,1546,"RIVER KHANDEPAR AT OPA NAN PONDA, GOA",GOA,29.0,7.3,7.0,247.0,1.5,0.2,1095.0,2453.0,2014,2014-01-28
528,2270,"RIVER KHANDEPAR AT CODLI NEAR BRIDGE ,U/S OPA WATERWORKS,SANGUEM",GOA,29.1,7.3,7.0,188.0,1.0,0.1,1286.0,3048.0,2014,2014-02-01
529,2272,"RIVER KUSHAWATI NEAR BUND AT KEVONA,RIVON,SANGUEM",GOA,28.7,7.0,6.9,224.0,1.2,0.3,3896.0,6742.0,2014,2014-02-02
530,1545,"RIVER MADAI AT DABOS NAN  VALPOI, GOA",GOA,28.7,7.3,6.7,144.0,1.5,0.1,1940.0,3052.0,2014,2014-02-03
531,2274,RIVER MAPUSA ON CULVERT ON HIGHWAY MAPUSANANPANAJI,GOA,29.5,5.3,6.8,319.0,1.8,0.3,6458.0,10250.0,2014,2014-02-04
532,2271,"RIVER SAL PAZORKHONI,CUNCOLIM(NEAR CULVERT MARGAONAN CANACONA NATIONAL HIGHWAY)",GOA,29.0,6.3,6.4,79.0,1.6,1.4,7592.0,12842.0,2014,2014-02-06
533,2273,"RIVER SAL NEAR HOTEL LEELA MOBOR,CAVELOSSIM",GOA,29.4,5.4,7.6,39.0,1.4,0.1,3176.0,6367.0,2014,2014-02-07
534,3184,"RIVER SAL AT ORLIM BRIDGE, ORLIM",GOA,30.1,5.2,7.1,192.0,2.6,0.3,5073.0,8925.0,2014,2014-02-08
535,3190,RIVER SINQUERIM (CANDOLIM SIDE NEAR BRIDGE),GOA,30.3,5.6,7.5,282.0,1.8,0.1,3205.0,5082.0,2014,2014-02-09
536,3191,RIVER SINQUERIM NEAR NERUL TEMPLE,GOA,30.5,5.5,7.4,275.0,1.5,0.1,4698.0,8625.0,2014,2014-02-14
537,1547,"RIVER TALPONA AT CANACONA, GOA",GOA,29.1,7.3,6.7,55.0,1.4,0.1,2638.0,4003.0,2014,2014-02-17
538,3188,RIVER TIRACOL AT TIRACOL,GOA,30.1,6.5,7.5,415.0,2.0,0.1,864.0,1538.0,2014,2014-02-18
539,1544,"RIVER VALVANT AT SANKLI NAN BICHOLIM, GOA",GOA,29.2,7.2,6.3,100.0,1.5,0.1,7942.0,13575.0,2014,2014-02-19
540,2651,"AMBA RIVER AT D/S OF WAKEN BRIDGENANU/S OF JS PETROCHEMICALS, WAKENPHATA, ROHA",MAHARASHTRA,25.1,6.6,7.8,95.0,4.9,0.2,16.0,36.0,2014,2014-02-20
541,1461,"BHATSA AT D/S OF PISE DAM NEAR PISE VILLAGE (ULHAS), MAHARASHTRA",MAHARASHTRA,29.6,6.9,7.9,99.0,5.0,0.4,15.0,34.0,2014,2014-02-23
542,2653,"BHATSA RIVER AT D/S OF LIBERTY OIL MILLS, SATNEL, SHAHAPUR, THANE",MAHARASHTRA,27.4,6.8,7.7,85.0,5.2,0.3,11.0,23.0,2014,2014-02-24
543,2654,"BHATSA RIVER AT U/S OF LIBERTY OIL MILLS, SATNEL, SHAHAPUR, THANE",MAHARASHTRA,27.8,6.7,7.8,80.0,4.9,0.3,12.0,29.0,2014,2014-02-25
544,1092,"KALU AT ATALE VILLAGE, MAHARASHTRA",MAHARASHTRA,30.6,5.1,7.3,3937.0,10.3,1.8,31.0,83.0,2014,2014-02-26
545,2670,"KAN RIVER, NEAR SAKRI WATER WORKS, SAKRI, DHULE.",MAHARASHTRA,25.0,5.6,7.9,468.0,3.6,1.9,66.0,164.0,2014,2014-03-01
546,1152,"KUNDALIKA AT ROHA CITY, MAHARASHTRA",MAHARASHTRA,25.0,6.4,7.6,541.0,5.7,0.6,23.0,45.0,2014,2014-03-02
547,2198,KUNDALIKA RIVER AT ARE KHURD ( SALINE ZONE ),MAHARASHTRA,25.0,5.5,7.4,6166.0,7.7,1.1,44.0,67.0,2014,2014-03-03
548,2672,"KUNDALIKA RIVER AT DHATAV AT JACKWELL (DRINKING WATER  PUMPING STATIONNANSWEET ZONE), ROHA",MAHARASHTRA,25.1,6.7,7.6,83.0,4.8,0.2,28.0,76.0,2014,2014-03-04
549,2168,MITHI RIVER,MAHARASHTRA,26.1,3.6,7.4,4424.0,31.3,2.2,276.0,474.0,2014,2014-03-05
550,2676,"MUCHKUNDI RIVER AT  WAKED,RATNAGIRI, NEAR M/S ASAHI INDIA GLASS LTD., LANJA, RATNAGIRI.",MAHARASHTRA,21.4,7.2,7.7,226.0,3.1,0.8,233.0,130.0,2014,2014-03-08
551,1151,"PATALGANGA AT SHILPHATA, MAHARASHTRA",MAHARASHTRA,27.4,5.9,7.4,268.0,6.4,0.4,37.0,68.0,2014,2014-03-09
552,1462,"PATALGANGA NEAR INTAKE OF MIDC W/W, MAHARASHTRA",MAHARASHTRA,27.1,5.4,7.5,2413.0,7.4,1.5,59.0,116.0,2014,2014-03-10
553,2685,"PATALGANGA RIVER AT D/S OF KHARPADA BRIDGE, RAIGAD.",MAHARASHTRA,27.2,5.8,7.3,384.0,5.4,0.6,37.0,78.0,2014,2014-03-12
554,2686,"PATALGANGA RIVER AT VYAL PUMP HOUSE , KHALAPUR, RAIGAD.",MAHARASHTRA,27.3,5.9,7.4,269.0,5.1,1.2,34.0,60.0,2014,2014-03-15
555,2687,"PATALGANGA RIVER AT KHALAPUR PUMPING STATION, KHALAPUR, RAIGAD.",MAHARASHTRA,27.0,6.0,7.3,269.0,8.5,0.4,32.0,58.0,2014,2014-03-16
556,2688,"PATALGANGA RIVER AT SAVROLI BRIDGE, KHALAPUR, RAIGAD.",MAHARASHTRA,27.2,6.1,7.3,196.0,6.1,0.5,30.0,63.0,2014,2014-03-18
557,2689,"PATALGANGA RIVER AT GAGANGIRI MAHARAJ TEMPLE, KHOPOLI, RAIGAD.",MAHARASHTRA,27.0,5.9,7.4,269.0,6.4,0.4,19.0,47.0,2014,2014-03-20
558,2696,"PEHLAR DAM ON PEHLAR RIVER INLET OF WATER WORKS, VASAI, THANE.",MAHARASHTRA,22.6,6.3,7.8,223.0,4.6,0.9,15.0,32.0,2014,2014-03-22
559,2199,SAVITRI RIVER AT OVALE VILLAGE.,MAHARASHTRA,28.4,6.7,7.3,9293.0,3.5,1.8,233.0,0.0,2014,2014-03-24
560,2701,"SAVITRI RIVER JACKWELL AT UPSA KENDRE, NANGALWADI, MAHAD, RAIGAD",MAHARASHTRA,28.0,6.8,7.2,170.0,3.1,1.4,233.0,0.0,2014,2014-03-25
561,2702,"SAVITRI RIVER AT SHEDAV DOH, MAHAD,RAIGAD",MAHARASHTRA,27.6,6.8,7.3,4175.0,3.3,1.6,233.0,0.0,2014,2014-03-26
562,2703,"SAVITRI RIVER AT DADLI BRIDGE, DADLI, MAHAD, RAIGADH",MAHARASHTRA,27.9,6.9,7.3,4282.0,3.3,1.6,233.0,0.0,2014,2014-03-28
563,2704,"SAVITRI RIVER AT MUTHAVALI VILLAGE, MAHAD, RAIGADH",MAHARASHTRA,28.1,6.9,7.3,5551.0,3.4,1.7,233.0,0.0,2014,2014-04-02
564,2706,"SURYA RIVER, U/S OF SURYA DAM, DHAMMI, VIKRAMGAD, THANE",MAHARASHTRA,27.1,6.8,7.9,5390.0,4.9,0.8,15.0,28.0,2014,2014-04-03
565,2707,"SURYA RIVER AT MIDC PUMPING STATION, GARVASHET, PALGHAR, THANE",MAHARASHTRA,27.6,6.6,8.1,161.0,4.6,0.3,16.0,32.0,2014,2014-04-04
566,2708,"SURYA RIVER AT INTAKE OF VASAINANVIRAR W/S SCHEME, MASVAN, PALGHAR, THANE",MAHARASHTRA,27.3,6.7,8.0,138.0,5.0,0.3,14.0,33.0,2014,2014-04-05
567,2709,"TANSA RIVER NEAR ROAD BRIDGE, VILLAGE DAKEWALI, WADA, THANE",MAHARASHTRA,27.8,6.7,7.8,81.0,4.9,0.3,14.0,35.0,2014,2014-04-07
568,1093,"ULHAS AT U/S OF NRC BUND AT MOHANE, MAHARASHTRA",MAHARASHTRA,28.0,5.9,7.7,194.0,5.5,0.6,22.0,51.0,2014,2014-04-09
569,1094,"ULHAS AT U/S OF BADLAPUR, MAHARASHTRA",MAHARASHTRA,28.1,6.3,7.6,186.0,4.6,0.6,13.0,31.0,2014,2014-04-11
570,2162,ULHAS RIVER ATJAMBHUL WATER WORKS.,MAHARASHTRA,28.6,6.6,7.6,207.0,4.7,0.7,12.0,31.0,2014,2014-04-12
571,2712,"VAITARNA RIVER NEAR ROAD BRIDGE, GANDHARE VILLAGE, WADA, THANE.",MAHARASHTRA,26.9,6.8,7.7,85.0,5.0,0.4,15.0,34.0,2014,2014-04-13
572,2164,VASHISTI RIVER AT U/S OF THREE M PAPER MILLS NEAR M/S MULTIFILMS PLASTIC PVT. LTD. AT KHERDI.,MAHARASHTRA,23.0,7.1,7.4,176.0,2.7,0.9,233.0,30.0,2014,2014-04-14
573,2713,"VASHISHTI RIVER AT D/S OF THREE M PAPER MILLS NEAR CHIPLUN WATER INTAKE JACKWELL, KHERDI, RATNAGIRI",MAHARASHTRA,23.0,7.0,7.4,178.0,2.7,0.9,233.0,40.0,2014,2014-04-15
574,2714,"VASHISHTI RIVER AT U/S OF POPHALI NEAR KONPHANSAWANE BRIDGE, CHIPLUN, RATNAGIRI",MAHARASHTRA,23.0,7.2,7.2,180.0,2.7,1.0,233.0,70.0,2014,2014-04-16
575,1342,"ACHENKOIL AT THUMPAMON, KERALA",KERALA,25.1,6.7,7.5,85.0,1.4,1.0,183.0,420.0,2014,2014-04-17
576,1443,"ACHENKOIL AT CHENNITHULA, KERALA",KERALA,24.6,5.8,7.4,77.0,1.4,0.8,285.0,691.0,2014,2014-04-18
577,3465,"ACHENKOIL AT KALLARAKADAVU, PATHANAMTHITTA",KERALA,25.7,6.6,7.5,75.0,1.4,0.7,183.0,448.0,2014,2014-04-19
578,3466,"ACHENKOIL AT PANDALAM (NEAR AYYAPPA TEMPLE), PATHANAMTHITTA",KERALA,24.8,6.7,7.5,82.0,1.4,1.0,161.0,443.0,2014,2014-04-20
579,2297,R ANCHARAKANDY AT MERUVAMBA,KERALA,27.3,6.7,6.9,56.0,0.9,0.2,82.0,172.0,2014,2014-04-21
580,2319,R ANCHARAKANDY AT MERUVAMBA,KERALA,27.5,6.5,6.7,2240.0,1.2,0.2,136.0,304.0,2014,2014-04-22
581,2286,R AYROOR AT AYROOR BRIDGE,KERALA,25.2,6.3,6.9,73.0,1.6,0.0,787.0,2008.0,2014,2014-04-23
582,2331,R BHARATHAPUZHA AT KUTTIPPURAM,KERALA,29.9,7.0,7.4,130.0,0.7,0.1,301.0,590.0,2014,2014-04-25
583,2332,R BHARATHAPUZHA AT PATTAMBI,KERALA,29.8,6.6,7.7,191.0,1.6,0.2,362.0,661.0,2014,2014-04-28
584,1154,"CHALAKUDY AT PULICKALKANANDAVU, KERALA",KERALA,27.8,6.9,6.9,134.0,1.1,0.4,249.0,531.0,2014,2014-05-02
585,20,"CHALIYAR AT KOOLIMADU, KERALA",KERALA,26.7,7.0,7.5,80.0,0.8,0.4,2573.0,3583.0,2014,2014-05-03
586,21,"CHALIYAR AT CHUNGAPALLY, KERALA",KERALA,25.8,6.7,7.4,14526.0,0.8,0.6,1411.0,1969.0,2014,2014-05-04
587,3464,"CHALIYAR AT NILAMBUR, MALAPPURAM",KERALA,26.4,7.2,7.4,82.0,0.7,0.5,840.0,1311.0,2014,2014-05-05
588,1572,"CHANDRAGIRI AT PADIYATHADKA, KERALA",KERALA,29.8,7.5,7.2,67.0,1.1,0.1,76.0,590.0,2014,2014-05-06
589,1573,"CHITRAPUZHA AT IRUMPANAM, KERALA",KERALA,28.6,3.0,6.6,965.0,1.7,1.2,247.0,530.0,2014,2014-05-08
590,2295,R CORAPUZHA AT KANAYANKODE,KERALA,26.9,5.9,7.4,17990.0,0.7,0.5,1888.0,2803.0,2014,2014-05-11
591,1564,"R ITHIKKARA AT AYUR, KERALA",KERALA,26.0,6.7,7.5,90.0,1.6,0.9,199.0,473.0,2014,2014-05-12
592,2287,R ITHIKKARA AT ITHIKKARA,KERALA,23.6,6.1,7.4,4429.0,2.0,1.6,243.0,550.0,2014,2014-05-13
593,1566,"R KADALUNDI AT THIRURANGADY, KERALA",KERALA,30.3,6.7,6.9,87.0,1.7,0.2,155.0,350.0,2014,2014-05-14
594,2293,R KADALUNDI AT HAJIRAPPALLY,KERALA,30.7,6.9,6.8,85.0,1.6,0.2,82.0,206.0,2014,2014-05-15
595,2338,R KADAMBAYAR AT MANCKAKADAVU,KERALA,28.2,2.5,6.9,83.0,1.9,0.3,353.0,656.0,2014,2014-05-16
596,42,"KALLADA AT PERUMTHOTTAMKADAVU, PUNALOOR, KERALA",KERALA,24.8,7.2,7.6,75.0,1.4,1.0,188.0,426.0,2014,2014-05-17
597,3460,"KALPATHI PUZHA AT KALPATHI, PALAKKAD",KERALA,29.2,6.1,7.6,281.0,1.2,0.7,384.0,718.0,2014,2014-05-18
598,3458,KARAPUZHA DAM AT WAYANAD,KERALA,26.6,6.7,7.6,106.0,0.5,2.5,44.0,71.0,2014,2014-05-20
599,1571,"R KARINGODE AT KAKKADAVU,  KERALA",KERALA,30.4,7.6,7.1,58.0,1.2,0.1,163.0,961.0,2014,2014-05-21
600,3471,"RIVER KARAMANA AT ARUVIKARA, THIRUVANANTHAPURAM",KERALA,25.1,7.4,7.0,35.0,0.1,0.0,165.0,409.0,2014,2014-05-24
601,2289,R KARUVANNURR AT KARUVANNUR BRIDGE,KERALA,28.9,6.4,7.2,63.0,1.3,0.4,121.0,535.0,2014,2014-05-25
602,2301,R KAVVAI AT KUTTIYOL PALAM,KERALA,28.8,5.4,6.7,65.0,1.1,0.3,60.0,144.0,2014,2014-05-26
603,2291,R KEECHERI AT VADAKKANCHERY BRIDGE,KERALA,29.3,5.6,7.3,90.0,1.6,0.4,268.0,705.0,2014,2014-06-01
604,2326,R KORAYAR AT KANJIKODE,KERALA,29.5,7.1,8.0,728.0,1.2,0.4,374.0,697.0,2014,2014-06-02
605,1569,"R KUPPAM AT THALIPARAMBA, KERALA",KERALA,28.4,5.9,6.8,13953.0,1.5,0.4,70.0,166.0,2014,2014-06-03
606,2298,R KUPPAM AT RAYAROM,KERALA,26.9,7.4,6.9,57.0,1.1,0.3,70.0,159.0,2014,2014-06-05
607,1567,"R KUTTIYADE AT KUTTIYADY ESTATE, KERALA",KERALA,25.8,7.2,7.2,41.0,0.7,0.2,441.0,658.0,2014,2014-06-06
608,1568,"R MAHE AT VALAYAM, KERALA",KERALA,26.6,6.5,7.4,71.0,0.6,0.3,4192.0,7018.0,2014,2014-06-07
609,2285,R MAMOM AT MAMOM BRIDGE,KERALA,25.3,6.8,7.1,81.0,0.8,0.0,389.0,1268.0,2014,2014-06-08
610,1340,"MANIMALA  AT KALLOOPARA, KERALA",KERALA,28.2,6.8,6.9,68.0,1.7,0.1,449.0,660.0,2014,2014-06-09
611,1384,"MANIMALA AT THONDRA, KERALA",KERALA,28.5,6.6,7.0,70.0,1.4,0.1,550.0,822.0,2014,2014-06-10
612,3459,"MANIYANKODE PUZHA AT MANIYANKODE BRIDGE, WAYANAD",KERALA,27.6,6.4,7.7,100.0,0.6,0.9,56.0,88.0,2014,2014-06-11
613,2307,R MANJESWAR AT BAJRAKKARA BR.,KERALA,29.0,7.3,6.9,96.0,1.9,0.2,89.0,825.0,2014,2014-06-12
614,1339,"MEENACHIL AT KIDANGOOR, KERALA",KERALA,27.5,6.8,6.6,49.0,0.5,0.4,1719.0,2950.0,2014,2014-06-13
615,43,"MUVATTAPUZHA AT VETTIKKATTUMUKKU, KERALA",KERALA,27.8,6.9,6.8,59.0,0.6,0.5,1916.0,3375.0,2014,2014-06-15
616,2302,R NEELASWARAM AT NAMBIARKAL DAM,KERALA,30.2,7.1,6.8,14410.0,1.8,0.1,65.0,468.0,2014,2014-06-16
617,1563,"R NEYYAR AT AMARAVILA, KERALA",KERALA,25.3,6.7,7.1,66.0,0.6,0.0,222.0,626.0,2014,2014-06-19
618,2284,R NEYYAR AT ARUVIPURAM,KERALA,25.3,7.2,7.0,59.0,0.6,0.0,165.0,433.0,2014,2014-06-20
619,2288,R PALLICKAL AT NELLIMUKAL,KERALA,25.8,6.0,7.6,120.0,1.3,1.1,212.0,523.0,2014,2014-06-22
620,1156,"PAMBA AT CHENGANNUR, KERALA",KERALA,27.2,5.2,6.8,55.0,0.6,0.7,171.0,313.0,2014,2014-06-23
621,1341,"PAMBA AT THAKAZHY, KERALA",KERALA,28.1,4.8,6.8,86.0,0.7,0.8,208.0,332.0,2014,2014-06-27
622,1565,"PAMBA DOWN, KERALA",KERALA,28.3,3.9,6.9,62.0,0.5,0.7,155.0,284.0,2014,2014-06-28
623,17,"PERIYAR NEAR ALWAYENANELOOR, KERALA",KERALA,28.1,5.0,6.9,3185.0,1.8,0.4,290.0,667.0,2014,2014-07-01
624,18,"PERIYAR AT KALADY, KERALA",KERALA,27.7,7.0,7.0,36.0,1.1,0.2,276.0,541.0,2014,2014-07-04
625,1338,"PERIYAR AT SEWAGE DISCHARGE POINT, KERALA",KERALA,28.0,6.3,6.9,64.0,1.2,0.3,381.0,815.0,2014,2014-07-06
626,2333,RIVER PERIYAR AT MUPPATHADAM,KERALA,28.2,6.2,6.9,86.0,1.3,0.2,372.0,1007.0,2014,2014-07-07
627,2334,RIVER PERIYAR AT PATHALAM,KERALA,28.0,5.7,6.8,2640.0,1.9,0.5,385.0,759.0,2014,2014-07-08
628,2335,R PERIYAR AT KALAMASSERY,KERALA,28.1,5.7,6.9,53.0,3.1,0.4,574.0,1205.0,2014,2014-07-09
629,2336,R PERIYAR AT PURAPPALLIKAVU,KERALA,28.1,6.6,7.1,2007.0,1.3,0.2,356.0,785.0,2014,2014-07-13
630,3468,"PERIYAR AT KWA INTAKENAN ALUVA, ERNAKULAM",KERALA,28.1,6.6,7.0,46.0,1.3,0.3,228.0,472.0,2014,2014-07-14
631,2300,R PERUVAMBA AT CHANDAPPURA,KERALA,27.3,6.5,6.5,43.0,0.9,0.4,87.0,188.0,2014,2014-07-15
632,2303,R PULLUR AT PULLUR BR.,KERALA,28.3,6.7,6.3,54.0,0.9,0.1,136.0,610.0,2014,2014-07-16
633,2290,R PUZHACKAL AT PUZHACKAL BRIDGE,KERALA,29.1,4.3,7.2,113.0,1.8,0.4,188.0,796.0,2014,2014-07-17
634,2299,R RAMAPURAM AT RAMAPURAM BRIDGE,KERALA,28.7,4.6,6.7,12561.0,1.5,0.6,72.0,171.0,2014,2014-07-18
635,2305,R SHRIYA AT ANGADIMOGARU,KERALA,28.5,7.7,6.9,61.0,1.6,0.0,88.0,554.0,2014,2014-07-21
636,2296,R THALLASSERY AT PATHIPPALAM,KERALA,26.6,5.8,6.5,61.0,1.0,0.4,70.0,151.0,2014,2014-07-23
637,2292,R THIRUR AT THALAKKADATHUR BRIDGE,KERALA,31.0,4.5,6.9,1614.0,2.1,0.6,131.0,230.0,2014,2014-07-24
638,3473,"RIVER VALAPATTANAM AT PARASSINIKADAVU, KANNUR",KERALA,28.8,6.6,7.0,14487.0,0.9,0.3,55.0,103.0,2014,2014-07-25
639,1442,"VAMANAPURAM, KERALA",KERALA,25.3,6.9,7.5,54.0,0.6,0.0,319.0,1633.0,2014,2014-07-26
640,1448,"NAGAVALLI AT THOTAPALLI REGULATOR, A.P.",ANDHRA PRADESH,25.9,5.5,7.6,569.0,1.3,0.9,18.0,141.0,2014,2014-07-27
641,2352,"RIVER VAMSHADHARA, KALINGAPATNAM,VIZIANAGARAM",ANDHRA PRADESH,26.5,5.4,7.8,310.0,0.8,2.4,7.0,107.0,2014,2014-08-02
642,3080,"U/S OF KARAKAVAGU AT PALONCHA,  KHAMMAM, A.P.",ANDHRA PRADESH,18.9,7.1,7.8,516.0,0.7,0.5,2.0,1238.0,2014,2014-08-04
643,3081,"D/S OF KARAKAVAGU AT PALONCHA,  KHAMMAM, A.P.",ANDHRA PRADESH,20.5,6.9,8.0,505.0,0.9,0.7,2.0,1563.0,2014,2014-08-05
644,1444,"KALI AT D/S WEST COAST PAPER MILL, KARNATAKA",KARNATAKA,27.1,7.3,7.3,109.0,2.4,3.4,18.0,65.0,2014,2014-08-08
645,2780,"KALI AT U/S OF WCPM, DANDELI, KARNATAKA",KARNATAKA,26.3,7.5,7.5,83.0,2.1,2.0,22.0,74.0,2014,2014-08-09
646,1894,KUMARADHARA NAN U/S OF UPPINAGADY TOWN BEFORE CONFLUENCE WITH RIVER NETHRAVATHI,KARNATAKA,29.1,6.4,7.2,102.0,1.0,0.0,137.0,1223.0,2014,2014-08-10
647,1892,NETRAVATHI U/S OF DHARMASTALA AT WATER SUPPLY INTAKE POINT,KARNATAKA,28.4,6.5,7.1,92.0,1.0,0.0,155.0,1342.0,2014,2014-08-11
648,2423,"BUDHABALANGA, D/S OF BARIPADA TOWN",ODISHA,24.7,7.7,7.9,232.0,1.3,0.8,30790.0,40500.0,2014,2014-08-12
649,2424,BUDHABALANGA AT BALASORE D/S,ODISHA,24.4,7.5,7.8,519.0,2.1,0.7,38700.0,53556.0,2014,2014-08-13
650,2425,"RIVER KERANDI(INTAKE WELL OF NALCO REFINARY, HAL, SUNABEDA)",ODISHA,22.7,7.3,7.2,103.0,0.7,1.7,4871.0,13810.0,2014,2014-08-15
651,2422,"NAGAVALLI AT PENTA U/S, JAYKAYPUR TOWN",ODISHA,24.8,7.4,7.9,196.0,0.7,0.6,5323.0,15213.0,2014,2014-08-18
652,1642,"NAGAVALLI AT JAYKAYPUR D/S, ODISHA",ODISHA,24.0,7.4,7.8,244.0,1.9,1.0,20880.0,12473.0,2014,2014-08-19
653,1643,"NAGAVALLI AT RAYAGADA D/S, ODISHA",ODISHA,22.8,7.5,8.0,243.0,1.7,0.9,8780.0,30319.0,2014,2014-08-21
654,1455,"RUSHIKULYA AT GANJAM U/S, ODISHA",ODISHA,26.8,7.2,8.0,296.0,1.5,0.7,1468.0,4314.0,2014,2014-08-22
655,2426,VANSADHARA AT MUNIGUDA (D/S OF M/S VEDANTAALUMINA PROJECT),ODISHA,25.3,7.5,7.9,194.0,1.0,1.0,2906.0,8559.0,2014,2014-08-23
656,2427,VANSADHARA ATGUNUPUR (INTERSTATE BOUNDRY),ODISHA,27.1,7.4,7.9,170.0,0.8,0.9,4948.0,16709.0,2014,2014-08-25
657,1685,"ARASALAR RIVER KARAIKAL REGION, PONDICHERRY",PONDICHERRY,29.0,6.7,7.3,386.0,1.8965,0.2,233.0,465.0,2014,2014-08-27
658,2445,MAHE RIVER,PONDICHERRY,32.0,6.0,7.1,13000.0,1.8965,0.4,233.0,465.0,2014,2014-08-28
659,1450,"PALAR AT VANIYAMBADI WATER SUPPLY HEAD WORK, TAMILNADU",TAMILNADU,29.3,6.5,7.4,1063.0,2.0,0.6,177.0,374.0,2014,2014-09-01
660,1159,"TAMBIRAPARANI AT BDG.NR. MADURA COATS LTD.PAPAVINASAM,TAMILNADU",TAMILNADU,22.8,6.8,6.6,63.0,2.9,0.1,11.0,36.0,2014,2014-09-02
661,1160,"TAMBIRAPARANI AT CHERANMADEVI,CAUSE WAY,TAMILNADU",TAMILNADU,24.5,6.6,6.4,101.0,2.5,0.2,13.0,41.0,2014,2014-09-03
662,1161,"TAMBIRAPARANI AT TIRUNELVELI,COLLECTORATE,TAMILNADU.",TAMILNADU,25.5,6.6,6.5,136.0,2.5,0.2,13.0,45.0,2014,2014-09-04
663,1162,"TAMBIRAPARANI AT MURAPPANADU, TAMILNADU",TAMILNADU,29.0,6.7,6.9,226.0,2.2,0.2,12.0,38.0,2014,2014-09-05
664,1328,"TAMBIRAPARANI AT PAPPANKULAM,TAMILNADU",TAMILNADU,23.8,6.7,6.3,72.0,2.7,0.2,9.0,32.0,2014,2014-09-06
665,1329,"TAMBIRAPARANI AT RAIL BDG. NR. AMBASAMUDAM, TAMILNADU",TAMILNADU,22.8,6.7,6.4,61.0,4.6,0.1,10.0,34.0,2014,2014-09-07
666,1330,"TAMBIRAPARANI AT ARUMUGANERI, TAMILNADU",TAMILNADU,29.0,6.6,7.2,1300.0,2.7,0.2,21.0,60.0,2014,2014-09-09
667,3025,"TAMBIRAPARANI AT ERAL, THOTHUKUDI, TAMILNADU",TAMILNADU,29.0,6.7,7.0,461.0,2.5,0.1,17.0,51.0,2014,2014-09-10
668,3026,"TAMBIRAPARANI AT KALLIDAI KURICHI, TIRUNELVELI, TAMILNADU",TAMILNADU,23.0,6.6,6.2,69.0,2.5,0.1,11.0,38.0,2014,2014-09-11
669,3027,"TAMBIRAPARANI AT SRIVAIKUNTAM, D/S OF SK ANAICUT, TIRUNELVELI, TAMILNADU",TAMILNADU,29.0,6.8,6.9,241.0,2.5,0.1,14.0,48.0,2014,2014-09-12
670,3028,"TAMBIRAPARANI AT VELLAKOIL, TIRUNELVELI, TAMILNADU",TAMILNADU,25.7,6.5,6.6,159.0,2.4,0.2,11.0,41.0,2014,2014-09-13
671,3029,"TAMBIRAPARANI AT SIVALAPERI, CONFLUENCE POINT OF KUTTRALAM FALLS, D/S OF PALAYAMKOTTAI, TIRUNELVELI, TAMILNADU",TAMILNADU,25.7,6.6,6.7,170.0,2.5,0.2,10.0,34.0,2014,2014-09-14
672,1885,RIVER GHAGGAR AT D/S OF SURAJPUR,HARYANA,27.0,6.7,7.3,198.0,1.8965,0.52,233.0,465.0,2014,2014-09-15
673,1023,"GHAGGAR AT MUBARAKPUR REST HOUSE (PATIALA), PUNJAB",PUNJAB,22.7,5.8,7.2,640.0,6.0,4.3,1450.0,4073.0,2014,2014-09-16
674,1024,"GHAGGAR AT 100M D/S CONF. WITH R. SARASWATI (PATIALA),PUNJAB",PUNJAB,19.0,4.8,7.6,1090.0,22.0,3.6,30500.0,52500.0,2014,2014-09-17
675,1295,"GHAGGAR NEAR BANKARPUR,DERA BASSI,PUNJAB",PUNJAB,23.0,5.5,7.3,705.0,10.0,5.0,2020.0,5433.0,2014,2014-09-18
676,1473,"GHAGGAR AT RATANHERI, D/S OF PATIALA NADI (AFTER CONFL.), PUNJAB",PUNJAB,24.0,5.1,7.4,1375.0,23.7,5.9,27333.0,50333.0,2014,2014-09-20
677,1698,"D/S CHHATBIR, PUNJAB",PUNJAB,24.7,5.5,7.4,745.0,10.0,6.1,12167.0,29333.0,2014,2014-09-22
678,1699,"U/S DHAKANSU NALLAH, PUNJAB",PUNJAB,25.0,5.0,7.6,975.0,16.3,6.1,11167.0,21667.0,2014,2014-09-23
679,1700,"D/S DHAKANSU NALLAH, PUNJAB",PUNJAB,22.0,4.9,7.7,1385.0,27.5,7.7,42500.0,72000.0,2014,2014-09-26
680,1701,"D/S JHARMAL NADI, PUNJAB",PUNJAB,24.3,5.0,7.3,1067.0,19.3,6.2,21467.0,39533.0,2014,2014-09-27
681,1702,"U/S JHARMAL NADI, PUNJAB",PUNJAB,23.3,5.3,7.2,970.0,13.3,5.9,3167.0,7133.0,2014,2014-09-28
682,1703,"GHAGGER AT MOONAK, PUNJAB",PUNJAB,19.5,4.9,7.7,1418.0,21.0,4.2,28000.0,49500.0,2014,2014-10-01
683,1704,"D/S SARDULGARH, PUNJAB",PUNJAB,21.5,4.1,7.5,1015.0,23.0,6.1,35000.0,57500.0,2014,2014-10-02
684,1705,"U/S SARDULGARH, PUNJAB",PUNJAB,20.0,4.8,7.4,854.0,17.0,4.7,20500.0,38000.0,2014,2014-10-03
685,1025,"GHAGGAR GHNAN1 AT ROAD BRDG. SIRSA,DEBWALI ROAD,HARYANA",HARYANA,27.0,6.7,8.2,198.0,19.8,0.0,233.0,465.0,2014,2014-10-04
686,1026,"GHAGGAR GHNAN2 AT CHANDARPUR SYPHON,  HARYANA",HARYANA,27.0,6.7,7.9,198.0,18.2,0.0,233.0,465.0,2014,2014-10-05
687,1718,"GAGGAR RIVER WHEN ENTERING IN RAJASTHAN FROM HARYANA NEAR RD NO. 629, RAJASTHAN",RAJASTHAN,32.6,4.0,6.8,370.0,3.0,0.8,4.0,9.0,2014,2014-10-06
